"No.","Time","Source","Destination","Protocol","Length","Info"
"46","11.237802683","192.168.101.100","192.168.101.200","TCP","2962","56694  >  1883 [ACK] Seq=1 Ack=1 Win=502 Len=2896 TSval=2288136298 TSecr=1826688062"
"47","11.237892264","192.168.101.100","192.168.101.200","TCP","1177","56694  >  1883 [PSH, ACK] Seq=2897 Ack=1 Win=502 Len=1111 TSval=2288136298 TSecr=1826688062"
"49","11.280640481","192.168.101.200","192.168.101.100","TCP","66","1883  >  56694 [ACK] Seq=1 Ack=1449 Win=1283 Len=0 TSval=1826893406 TSecr=2288136298"
"51","11.293109448","192.168.101.200","192.168.101.100","TCP","66","1883  >  56694 [ACK] Seq=1 Ack=4008 Win=1267 Len=0 TSval=1826893418 TSecr=2288136298"
"52","11.294168713","192.168.101.200","192.168.101.100","TCP","70","1883  >  56694 [PSH, ACK] Seq=1 Ack=4008 Win=1283 Len=4 TSval=1826893419 TSecr=2288136298"
"55","11.616777834","192.168.101.200","192.168.101.100","TCP","70","[TCP Retransmission] 1883  >  56694 [PSH, ACK] Seq=1 Ack=4008 Win=1283 Len=4 TSval=1826893742 TSecr=2288136298"
"56","11.936934024","192.168.101.200","192.168.101.100","TCP","70","[TCP Retransmission] 1883  >  56694 [PSH, ACK] Seq=1 Ack=4008 Win=1283 Len=4 TSval=1826894062 TSecr=2288136298"
"58","11.937124286","192.168.101.100","192.168.101.200","TCP","66","56694  >  1883 [ACK] Seq=4008 Ack=5 Win=502 Len=0 TSval=2288136998 TSecr=1826894062"
"63","12.263249776","192.168.101.100","192.168.101.200","TCP","2962","56694  >  1883 [ACK] Seq=4008 Ack=5 Win=502 Len=2896 TSval=2288137324 TSecr=1826894062"
"64","12.263377429","192.168.101.100","192.168.101.200","TCP","1177","56694  >  1883 [PSH, ACK] Seq=6904 Ack=5 Win=502 Len=1111 TSval=2288137324 TSecr=1826894062"
"67","12.293501190","192.168.101.200","192.168.101.100","TCP","66","1883  >  56694 [ACK] Seq=5 Ack=8015 Win=1267 Len=0 TSval=1826894419 TSecr=2288137324"
"68","12.295644675","192.168.101.200","192.168.101.100","TCP","70","1883  >  56694 [PSH, ACK] Seq=5 Ack=8015 Win=1283 Len=4 TSval=1826894421 TSecr=2288137324"
"71","12.391359875","192.168.101.100","192.168.101.200","TCP","66","56694  >  1883 [ACK] Seq=8015 Ack=9 Win=502 Len=0 TSval=2288137452 TSecr=1826894421"
"77","13.279953095","192.168.101.100","192.168.101.200","TCP","2962","56694  >  1883 [ACK] Seq=8015 Ack=9 Win=502 Len=2896 TSval=2288138340 TSecr=1826894421"
"78","13.280113350","192.168.101.100","192.168.101.200","TCP","1177","56694  >  1883 [PSH, ACK] Seq=10911 Ack=9 Win=502 Len=1111 TSval=2288138340 TSecr=1826894421"
"80","13.398295833","192.168.101.200","192.168.101.100","TCP","78","[TCP Dup ACK 67#1] 1883  >  56694 [ACK] Seq=9 Ack=8015 Win=1283 Len=0 TSval=1826895524 TSecr=2288137452 SLE=10911 SRE=12022"
"82","13.411774018","192.168.101.100","192.168.101.200","TCP","1514","[TCP Fast Retransmission] 56694  >  1883 [ACK] Seq=8015 Ack=9 Win=502 Len=1448 TSval=2288138472 TSecr=1826895524"
"84","13.412208481","192.168.101.200","192.168.101.100","TCP","78","1883  >  56694 [ACK] Seq=9 Ack=9463 Win=1272 Len=0 TSval=1826895538 TSecr=2288138472 SLE=10911 SRE=12022"
"86","13.490941575","192.168.101.100","192.168.101.200","TCP","1514","[TCP Retransmission] 56694  >  1883 [ACK] Seq=9463 Ack=9 Win=502 Len=1448 TSval=2288138551 TSecr=1826895538"
"88","13.491411882","192.168.101.200","192.168.101.100","TCP","66","1883  >  56694 [ACK] Seq=9 Ack=12022 Win=1267 Len=0 TSval=1826895617 TSecr=2288138551"
"89","13.530864311","192.168.101.200","192.168.101.100","TCP","70","1883  >  56694 [PSH, ACK] Seq=9 Ack=12022 Win=1283 Len=4 TSval=1826895656 TSecr=2288138551"
"91","13.824907196","192.168.101.200","192.168.101.100","TCP","70","[TCP Retransmission] 1883  >  56694 [PSH, ACK] Seq=9 Ack=12022 Win=1283 Len=4 TSval=1826895950 TSecr=2288138551"
"93","13.825088444","192.168.101.100","192.168.101.200","TCP","66","56694  >  1883 [ACK] Seq=12022 Ack=13 Win=502 Len=0 TSval=2288138886 TSecr=1826895950"
"96","14.294534657","192.168.101.100","192.168.101.200","TCP","1514","56694  >  1883 [ACK] Seq=12022 Ack=13 Win=502 Len=1448 TSval=2288139355 TSecr=1826895950"
"97","14.294612544","192.168.101.100","192.168.101.200","TCP","1514","56694  >  1883 [ACK] Seq=13470 Ack=13 Win=502 Len=1448 TSval=2288139355 TSecr=1826895950"
"99","14.295111827","192.168.101.200","192.168.101.100","TCP","78","[TCP Dup ACK 88#1] 1883  >  56694 [ACK] Seq=13 Ack=12022 Win=1283 Len=0 TSval=1826896420 TSecr=2288138886 SLE=13470 SRE=14918"
"101","14.399479333","192.168.101.100","192.168.101.200","TCP","1177","56694  >  1883 [PSH, ACK] Seq=14918 Ack=13 Win=502 Len=1111 TSval=2288139460 TSecr=1826896420"
"103","14.399965123","192.168.101.200","192.168.101.100","TCP","78","[TCP Dup ACK 88#3] 1883  >  56694 [ACK] Seq=13 Ack=12022 Win=1283 Len=0 TSval=1826896525 TSecr=2288138886 SLE=13470 SRE=16029"
"104","14.415132055","192.168.101.100","192.168.101.200","TCP","1514","[TCP Fast Retransmission] 56694  >  1883 [ACK] Seq=12022 Ack=13 Win=502 Len=1448 TSval=2288139476 TSecr=1826896420"
"107","14.491018081","192.168.101.200","192.168.101.100","TCP","66","1883  >  56694 [ACK] Seq=13 Ack=16029 Win=1259 Len=0 TSval=1826896616 TSecr=2288139476"
"108","14.541329299","192.168.101.200","192.168.101.100","TCP","70","1883  >  56694 [PSH, ACK] Seq=13 Ack=16029 Win=1283 Len=4 TSval=1826896667 TSecr=2288139476"
"111","14.588549724","192.168.101.100","192.168.101.200","TCP","66","56694  >  1883 [ACK] Seq=16029 Ack=17 Win=502 Len=0 TSval=2288139649 TSecr=1826896667"
"113","15.307782303","192.168.101.100","192.168.101.200","TCP","1514","56694  >  1883 [ACK] Seq=16029 Ack=17 Win=502 Len=1448 TSval=2288140368 TSecr=1826896667"
"114","15.307902752","192.168.101.100","192.168.101.200","TCP","1514","56694  >  1883 [ACK] Seq=17477 Ack=17 Win=502 Len=1448 TSval=2288140368 TSecr=1826896667"
"116","15.308631894","192.168.101.200","192.168.101.100","TCP","66","1883  >  56694 [ACK] Seq=17 Ack=18925 Win=1267 Len=0 TSval=1826897434 TSecr=2288140368"
"119","15.388103785","192.168.101.100","192.168.101.200","TCP","1177","56694  >  1883 [PSH, ACK] Seq=18925 Ack=17 Win=502 Len=1111 TSval=2288140449 TSecr=1826897434"
"123","15.388400702","192.168.101.200","192.168.101.100","TCP","66","1883  >  56694 [ACK] Seq=17 Ack=20036 Win=1274 Len=0 TSval=1826897514 TSecr=2288140449"
"124","15.419319229","192.168.101.200","192.168.101.100","TCP","70","1883  >  56694 [PSH, ACK] Seq=17 Ack=20036 Win=1283 Len=4 TSval=1826897545 TSecr=2288140449"
"126","15.712806550","192.168.101.200","192.168.101.100","TCP","70","[TCP Retransmission] 1883  >  56694 [PSH, ACK] Seq=17 Ack=20036 Win=1283 Len=4 TSval=1826897838 TSecr=2288140449"
"128","15.712999441","192.168.101.100","192.168.101.200","TCP","66","56694  >  1883 [ACK] Seq=20036 Ack=21 Win=502 Len=0 TSval=2288140774 TSecr=1826897838"
"133","16.350611760","192.168.101.100","192.168.101.200","TCP","1514","56694  >  1883 [ACK] Seq=20036 Ack=21 Win=502 Len=1448 TSval=2288141411 TSecr=1826897838"
"134","16.350715739","192.168.101.100","192.168.101.200","TCP","1514","56694  >  1883 [ACK] Seq=21484 Ack=21 Win=502 Len=1448 TSval=2288141411 TSecr=1826897838"
"136","16.387646515","192.168.101.200","192.168.101.100","TCP","78","[TCP Dup ACK 123#1] 1883  >  56694 [ACK] Seq=21 Ack=20036 Win=1283 Len=0 TSval=1826898513 TSecr=2288140774 SLE=21484 SRE=22932"
"138","16.387777879","192.168.101.100","192.168.101.200","TCP","1177","56694  >  1883 [PSH, ACK] Seq=22932 Ack=21 Win=502 Len=1111 TSval=2288141449 TSecr=1826898513"
"139","16.403287478","192.168.101.100","192.168.101.200","TCP","1514","[TCP Fast Retransmission] 56694  >  1883 [ACK] Seq=20036 Ack=21 Win=502 Len=1448 TSval=2288141464 TSecr=1826898513"
"142","16.485572142","192.168.101.200","192.168.101.100","TCP","78","[TCP Dup ACK 123#3] 1883  >  56694 [ACK] Seq=21 Ack=20036 Win=1283 Len=0 TSval=1826898611 TSecr=2288140774 SLE=21484 SRE=24043"
"143","16.485615591","192.168.101.200","192.168.101.100","TCP","66","1883  >  56694 [ACK] Seq=21 Ack=24043 Win=1259 Len=0 TSval=1826898611 TSecr=2288141464"
"144","16.487090793","192.168.101.200","192.168.101.100","TCP","70","1883  >  56694 [PSH, ACK] Seq=21 Ack=24043 Win=1283 Len=4 TSval=1826898613 TSecr=2288141464"
"148","16.583474753","192.168.101.100","192.168.101.200","TCP","66","56694  >  1883 [ACK] Seq=24043 Ack=25 Win=502 Len=0 TSval=2288141644 TSecr=1826898613"
"151","17.390239451","192.168.101.100","192.168.101.200","TCP","1514","56694  >  1883 [ACK] Seq=24043 Ack=25 Win=502 Len=1448 TSval=2288142451 TSecr=1826898613"
"152","17.390303159","192.168.101.100","192.168.101.200","TCP","1514","56694  >  1883 [ACK] Seq=25491 Ack=25 Win=502 Len=1448 TSval=2288142451 TSecr=1826898613"
"154","17.390945740","192.168.101.200","192.168.101.100","TCP","66","1883  >  56694 [ACK] Seq=25 Ack=26939 Win=1283 Len=0 TSval=1826899517 TSecr=2288142451"
"156","17.489467862","192.168.101.100","192.168.101.200","TCP","1177","56694  >  1883 [PSH, ACK] Seq=26939 Ack=25 Win=502 Len=1111 TSval=2288142551 TSecr=1826899517"
"158","17.493457472","192.168.101.200","192.168.101.100","TCP","70","1883  >  56694 [PSH, ACK] Seq=25 Ack=28050 Win=1283 Len=4 TSval=1826899619 TSecr=2288142551"
"160","17.593054608","192.168.101.100","192.168.101.200","TCP","66","56694  >  1883 [ACK] Seq=28050 Ack=29 Win=502 Len=0 TSval=2288142654 TSecr=1826899619"
"166","18.431524698","192.168.101.100","192.168.101.200","TCP","1514","56694  >  1883 [ACK] Seq=28050 Ack=29 Win=502 Len=1448 TSval=2288143493 TSecr=1826899619"
"167","18.431628461","192.168.101.100","192.168.101.200","TCP","1514","56694  >  1883 [ACK] Seq=29498 Ack=29 Win=502 Len=1448 TSval=2288143493 TSecr=1826899619"
"169","18.432015087","192.168.101.200","192.168.101.100","TCP","78","[TCP Dup ACK 158#1] 1883  >  56694 [ACK] Seq=29 Ack=28050 Win=1283 Len=0 TSval=1826900558 TSecr=2288142654 SLE=29498 SRE=30946"
"171","18.489211490","192.168.101.100","192.168.101.200","TCP","1173","56694  >  1883 [PSH, ACK] Seq=30946 Ack=29 Win=502 Len=1107 TSval=2288143551 TSecr=1826900558"
"173","18.489805650","192.168.101.200","192.168.101.100","TCP","78","[TCP Dup ACK 158#3] 1883  >  56694 [ACK] Seq=29 Ack=28050 Win=1283 Len=0 TSval=1826900616 TSecr=2288142654 SLE=29498 SRE=32053"
"174","18.503030017","192.168.101.100","192.168.101.200","TCP","1514","[TCP Fast Retransmission] 56694  >  1883 [ACK] Seq=28050 Ack=29 Win=502 Len=1448 TSval=2288143564 TSecr=1826900558"
"177","18.587414056","192.168.101.200","192.168.101.100","TCP","66","1883  >  56694 [ACK] Seq=29 Ack=32053 Win=1259 Len=0 TSval=1826900714 TSecr=2288143564"
"178","18.588283609","192.168.101.200","192.168.101.100","TCP","70","1883  >  56694 [PSH, ACK] Seq=29 Ack=32053 Win=1283 Len=4 TSval=1826900714 TSecr=2288143564"
"181","18.685315053","192.168.101.100","192.168.101.200","TCP","66","56694  >  1883 [ACK] Seq=32053 Ack=33 Win=502 Len=0 TSval=2288143747 TSecr=1826900714"
"184","19.450657050","192.168.101.100","192.168.101.200","TCP","1514","56694  >  1883 [ACK] Seq=32053 Ack=33 Win=502 Len=1448 TSval=2288144512 TSecr=1826900714"
"185","19.450743047","192.168.101.100","192.168.101.200","TCP","1514","56694  >  1883 [ACK] Seq=33501 Ack=33 Win=502 Len=1448 TSval=2288144512 TSecr=1826900714"
"187","19.451296151","192.168.101.200","192.168.101.100","TCP","78","[TCP Dup ACK 177#1] 1883  >  56694 [ACK] Seq=33 Ack=32053 Win=1283 Len=0 TSval=1826901578 TSecr=2288143747 SLE=33501 SRE=34949"
"189","19.489319261","192.168.101.100","192.168.101.200","TCP","1177","56694  >  1883 [PSH, ACK] Seq=34949 Ack=33 Win=502 Len=1111 TSval=2288144551 TSecr=1826901578"
"190","19.503022643","192.168.101.100","192.168.101.200","TCP","1514","[TCP Fast Retransmission] 56694  >  1883 [ACK] Seq=32053 Ack=33 Win=502 Len=1448 TSval=2288144565 TSecr=1826901578"
"192","19.591148275","192.168.101.200","192.168.101.100","TCP","66","1883  >  56694 [ACK] Seq=33 Ack=34949 Win=1267 Len=0 TSval=1826901718 TSecr=2288144565"
"194","19.695731010","192.168.101.100","192.168.101.200","TCP","1177","[TCP Retransmission] 56694  >  1883 [PSH, ACK] Seq=34949 Ack=33 Win=502 Len=1111 TSval=2288144757 TSecr=1826901718"
"196","19.696257180","192.168.101.200","192.168.101.100","TCP","66","1883  >  56694 [ACK] Seq=33 Ack=36060 Win=1274 Len=0 TSval=1826901823 TSecr=2288144757"
"197","19.697005370","192.168.101.200","192.168.101.100","TCP","70","1883  >  56694 [PSH, ACK] Seq=33 Ack=36060 Win=1283 Len=4 TSval=1826901824 TSecr=2288144757"
"200","19.785751075","192.168.101.100","192.168.101.200","TCP","66","56694  >  1883 [ACK] Seq=36060 Ack=37 Win=502 Len=0 TSval=2288144848 TSecr=1826901824"
"211","20.468737655","192.168.101.100","192.168.101.200","TCP","1514","56694  >  1883 [ACK] Seq=36060 Ack=37 Win=502 Len=1448 TSval=2288145531 TSecr=1826901824"
"212","20.468878004","192.168.101.100","192.168.101.200","TCP","1514","56694  >  1883 [ACK] Seq=37508 Ack=37 Win=502 Len=1448 TSval=2288145531 TSecr=1826901824"
"214","20.755542142","192.168.101.100","192.168.101.200","TCP","1177","56694  >  1883 [PSH, ACK] Seq=38956 Ack=37 Win=502 Len=1111 TSval=2288145818 TSecr=1826901824"
"216","20.756215246","192.168.101.200","192.168.101.100","TCP","78","[TCP Dup ACK 196#1] 1883  >  56694 [ACK] Seq=37 Ack=36060 Win=1283 Len=0 TSval=1826902883 TSecr=2288144848 SLE=38956 SRE=40067"
"218","20.756483155","192.168.101.100","192.168.101.200","TCP","1514","[TCP Fast Retransmission] 56694  >  1883 [ACK] Seq=36060 Ack=37 Win=502 Len=1448 TSval=2288145819 TSecr=1826902883"
"220","20.757069108","192.168.101.200","192.168.101.100","TCP","78","1883  >  56694 [ACK] Seq=37 Ack=37508 Win=1272 Len=0 TSval=1826902884 TSecr=2288145819 SLE=38956 SRE=40067"
"223","20.796307028","192.168.101.100","192.168.101.200","TCP","1514","[TCP Retransmission] 56694  >  1883 [ACK] Seq=37508 Ack=37 Win=502 Len=1448 TSval=2288145858 TSecr=1826902884"
"225","20.796765528","192.168.101.200","192.168.101.100","TCP","66","1883  >  56694 [ACK] Seq=37 Ack=40067 Win=1267 Len=0 TSval=1826902924 TSecr=2288145858"
"226","20.797893184","192.168.101.200","192.168.101.100","TCP","70","1883  >  56694 [PSH, ACK] Seq=37 Ack=40067 Win=1283 Len=4 TSval=1826902925 TSecr=2288145858"
"227","21.087249889","192.168.101.200","192.168.101.100","TCP","70","[TCP Retransmission] 1883  >  56694 [PSH, ACK] Seq=37 Ack=40067 Win=1283 Len=4 TSval=1826903214 TSecr=2288145858"
"229","21.087459555","192.168.101.100","192.168.101.200","TCP","66","56694  >  1883 [ACK] Seq=40067 Ack=41 Win=502 Len=0 TSval=2288146150 TSecr=1826903214"
"235","21.484912371","192.168.101.100","192.168.101.200","TCP","1514","56694  >  1883 [ACK] Seq=40067 Ack=41 Win=502 Len=1448 TSval=2288146547 TSecr=1826903214"
"236","21.485056621","192.168.101.100","192.168.101.200","TCP","1514","56694  >  1883 [ACK] Seq=41515 Ack=41 Win=502 Len=1448 TSval=2288146547 TSecr=1826903214"
"239","21.492235058","192.168.101.200","192.168.101.100","TCP","66","1883  >  56694 [ACK] Seq=41 Ack=42963 Win=1283 Len=0 TSval=1826903619 TSecr=2288146547"
"240","21.747130796","192.168.101.100","192.168.101.200","TCP","1177","56694  >  1883 [PSH, ACK] Seq=42963 Ack=41 Win=502 Len=1111 TSval=2288146809 TSecr=1826903214"
"242","21.749484300","192.168.101.200","192.168.101.100","TCP","70","1883  >  56694 [PSH, ACK] Seq=41 Ack=44074 Win=1283 Len=4 TSval=1826903876 TSecr=2288146809"
"244","21.749789755","192.168.101.100","192.168.101.200","TCP","66","56694  >  1883 [ACK] Seq=44074 Ack=45 Win=502 Len=0 TSval=2288146812 TSecr=1826903876"
"246","22.023079932","192.168.101.200","192.168.101.100","TCP","70","[TCP Spurious Retransmission] 1883  >  56694 [PSH, ACK] Seq=41 Ack=44074 Win=1283 Len=4 TSval=1826904150 TSecr=2288146809"
"250","22.496925176","192.168.101.100","192.168.101.200","TCP","2962","56694  >  1883 [ACK] Seq=44074 Ack=45 Win=502 Len=2896 TSval=2288147559 TSecr=1826903876"
"251","22.497020901","192.168.101.100","192.168.101.200","TCP","1177","56694  >  1883 [PSH, ACK] Seq=46970 Ack=45 Win=502 Len=1111 TSval=2288147559 TSecr=1826903876"
"253","22.497623098","192.168.101.200","192.168.101.100","TCP","78","[TCP Dup ACK 242#1] 1883  >  56694 [ACK] Seq=45 Ack=44074 Win=1283 Len=0 TSval=1826904625 TSecr=2288146809 SLE=45522 SRE=46970"
"255","22.588913111","192.168.101.200","192.168.101.100","TCP","78","[TCP Dup ACK 242#2] 1883  >  56694 [ACK] Seq=45 Ack=44074 Win=1283 Len=0 TSval=1826904716 TSecr=2288146809 SLE=45522 SRE=48081"
"258","22.699880454","192.168.101.100","192.168.101.200","TCP","1514","[TCP Fast Retransmission] 56694  >  1883 [ACK] Seq=44074 Ack=45 Win=502 Len=1448 TSval=2288147762 TSecr=1826904716"
"260","22.700761356","192.168.101.200","192.168.101.100","TCP","66","1883  >  56694 [ACK] Seq=45 Ack=48081 Win=1259 Len=0 TSval=1826904828 TSecr=2288147762"
"261","22.755500494","192.168.101.200","192.168.101.100","TCP","70","1883  >  56694 [PSH, ACK] Seq=45 Ack=48081 Win=1283 Len=4 TSval=1826904883 TSecr=2288147762"
"264","22.784686170","192.168.101.100","192.168.101.200","TCP","66","56694  >  1883 [ACK] Seq=48081 Ack=49 Win=502 Len=0 TSval=2288147847 TSecr=1826904883"
"270","23.518077321","192.168.101.100","192.168.101.200","TCP","1514","56694  >  1883 [ACK] Seq=48081 Ack=49 Win=502 Len=1448 TSval=2288148581 TSecr=1826904883"
"271","23.518137207","192.168.101.100","192.168.101.200","TCP","1514","56694  >  1883 [ACK] Seq=49529 Ack=49 Win=502 Len=1448 TSval=2288148581 TSecr=1826904883"
"273","23.518744957","192.168.101.200","192.168.101.100","TCP","66","1883  >  56694 [ACK] Seq=49 Ack=50977 Win=1267 Len=0 TSval=1826905646 TSecr=2288148581"
"275","23.593504887","192.168.101.100","192.168.101.200","TCP","1177","56694  >  1883 [PSH, ACK] Seq=50977 Ack=49 Win=502 Len=1111 TSval=2288148656 TSecr=1826905646"
"277","23.593968873","192.168.101.200","192.168.101.100","TCP","66","1883  >  56694 [ACK] Seq=49 Ack=52088 Win=1274 Len=0 TSval=1826905722 TSecr=2288148656"
"278","23.594687525","192.168.101.200","192.168.101.100","TCP","70","1883  >  56694 [PSH, ACK] Seq=49 Ack=52088 Win=1283 Len=4 TSval=1826905722 TSecr=2288148656"
"281","23.686255350","192.168.101.100","192.168.101.200","TCP","66","56694  >  1883 [ACK] Seq=52088 Ack=53 Win=502 Len=0 TSval=2288148749 TSecr=1826905722"
"285","24.538752490","192.168.101.100","192.168.101.200","TCP","1514","56694  >  1883 [ACK] Seq=52088 Ack=53 Win=502 Len=1448 TSval=2288149602 TSecr=1826905722"
"286","24.538985697","192.168.101.100","192.168.101.200","TCP","1514","56694  >  1883 [ACK] Seq=53536 Ack=53 Win=502 Len=1448 TSval=2288149602 TSecr=1826905722"
"287","24.539047510","192.168.101.100","192.168.101.200","TCP","1173","56694  >  1883 [PSH, ACK] Seq=54984 Ack=53 Win=502 Len=1107 TSval=2288149602 TSecr=1826905722"
"289","24.539494792","192.168.101.200","192.168.101.100","TCP","66","1883  >  56694 [ACK] Seq=53 Ack=54984 Win=1283 Len=0 TSval=1826906667 TSecr=2288149602"
"291","24.585820050","192.168.101.200","192.168.101.100","TCP","70","1883  >  56694 [PSH, ACK] Seq=53 Ack=56091 Win=1283 Len=4 TSval=1826906714 TSecr=2288149602"
"293","25.054824967","192.168.101.200","192.168.101.100","TCP","70","[TCP Retransmission] 1883  >  56694 [PSH, ACK] Seq=53 Ack=56091 Win=1283 Len=4 TSval=1826907183 TSecr=2288149602"
"295","25.055135941","192.168.101.100","192.168.101.200","TCP","66","56694  >  1883 [ACK] Seq=56091 Ack=57 Win=502 Len=0 TSval=2288150118 TSecr=1826907183"
"298","25.551312538","192.168.101.100","192.168.101.200","TCP","2962","56694  >  1883 [ACK] Seq=56091 Ack=57 Win=502 Len=2896 TSval=2288150615 TSecr=1826907183"
"299","25.551412439","192.168.101.100","192.168.101.200","TCP","1177","56694  >  1883 [PSH, ACK] Seq=58987 Ack=57 Win=502 Len=1111 TSval=2288150615 TSecr=1826907183"
"301","25.551914055","192.168.101.200","192.168.101.100","TCP","66","1883  >  56694 [ACK] Seq=57 Ack=58987 Win=1283 Len=0 TSval=1826907680 TSecr=2288150615"
"303","25.583974214","192.168.101.200","192.168.101.100","TCP","70","1883  >  56694 [PSH, ACK] Seq=57 Ack=60098 Win=1283 Len=4 TSval=1826907712 TSecr=2288150615"
"305","26.259199615","192.168.101.100","192.168.101.200","TCP","1177","[TCP Retransmission] 56694  >  1883 [PSH, ACK] Seq=58987 Ack=57 Win=502 Len=1111 TSval=2288151323 TSecr=1826907680"
"306","26.398598568","192.168.101.200","192.168.101.100","TCP","70","[TCP Retransmission] 1883  >  56694 [PSH, ACK] Seq=57 Ack=60098 Win=1283 Len=4 TSval=1826908527 TSecr=2288150615"
"308","26.398812498","192.168.101.100","192.168.101.200","TCP","66","56694  >  1883 [ACK] Seq=60098 Ack=61 Win=502 Len=0 TSval=2288151462 TSecr=1826908527"
"310","26.577992449","192.168.101.100","192.168.101.200","TCP","2962","56694  >  1883 [ACK] Seq=60098 Ack=61 Win=502 Len=2896 TSval=2288151642 TSecr=1826908527"
"311","26.578066041","192.168.101.100","192.168.101.200","TCP","1177","56694  >  1883 [PSH, ACK] Seq=62994 Ack=61 Win=502 Len=1111 TSval=2288151642 TSecr=1826908527"
"313","26.578480686","192.168.101.200","192.168.101.100","TCP","78","[TCP Dup ACK 306#1] 1883  >  56694 [ACK] Seq=61 Ack=60098 Win=1283 Len=0 TSval=1826908707 TSecr=2288150615 SLE=61546 SRE=62994"
"315","26.699677150","192.168.101.100","192.168.101.200","TCP","1514","[TCP Fast Retransmission] 56694  >  1883 [ACK] Seq=60098 Ack=61 Win=502 Len=1448 TSval=2288151763 TSecr=1826908707"
"317","26.700247558","192.168.101.200","192.168.101.100","TCP","66","1883  >  56694 [ACK] Seq=61 Ack=62994 Win=1267 Len=0 TSval=1826908829 TSecr=2288151763"
"319","26.786382160","192.168.101.100","192.168.101.200","TCP","1177","[TCP Retransmission] 56694  >  1883 [PSH, ACK] Seq=62994 Ack=61 Win=502 Len=1111 TSval=2288151850 TSecr=1826908829"
"324","27.599333639","192.168.101.100","192.168.101.200","TCP","1514","56694  >  1883 [ACK] Seq=64105 Ack=61 Win=502 Len=1448 TSval=2288152663 TSecr=1826908829"
"326","27.599856352","192.168.101.200","192.168.101.100","TCP","78","[TCP Window Update] 1883  >  56694 [ACK] Seq=61 Ack=62994 Win=1274 Len=0 TSval=1826909729 TSecr=2288151763 SLE=64105 SRE=65553"
"328","27.600057451","192.168.101.100","192.168.101.200","TCP","1177","[TCP Fast Retransmission] 56694  >  1883 [PSH, ACK] Seq=62994 Ack=61 Win=502 Len=1111 TSval=2288152664 TSecr=1826909729"
"330","27.600407410","192.168.101.200","192.168.101.100","TCP","66","1883  >  56694 [ACK] Seq=61 Ack=65553 Win=1267 Len=0 TSval=1826909729 TSecr=2288152664"
"331","27.639489469","192.168.101.200","192.168.101.100","TCP","70","1883  >  56694 [PSH, ACK] Seq=61 Ack=65553 Win=1283 Len=4 TSval=1826909768 TSecr=2288152664"
"333","27.678479942","192.168.101.100","192.168.101.200","TCP","1514","56694  >  1883 [ACK] Seq=65553 Ack=61 Win=502 Len=1448 TSval=2288152742 TSecr=1826909729"
"334","27.678523191","192.168.101.100","192.168.101.200","TCP","1177","56694  >  1883 [PSH, ACK] Seq=67001 Ack=61 Win=502 Len=1111 TSval=2288152742 TSecr=1826909729"
"336","27.678549740","192.168.101.100","192.168.101.200","TCP","66","56694  >  1883 [ACK] Seq=68112 Ack=65 Win=502 Len=0 TSval=2288152742 TSecr=1826909768"
"338","27.746142768","192.168.101.200","192.168.101.100","TCP","66","1883  >  56694 [ACK] Seq=65 Ack=67001 Win=1283 Len=0 TSval=1826909875 TSecr=2288152742"
"342","27.776725884","192.168.101.200","192.168.101.100","TCP","66","1883  >  56694 [ACK] Seq=65 Ack=68112 Win=1275 Len=0 TSval=1826909905 TSecr=2288152742"
"343","27.777499142","192.168.101.200","192.168.101.100","TCP","70","1883  >  56694 [PSH, ACK] Seq=65 Ack=68112 Win=1283 Len=4 TSval=1826909906 TSecr=2288152742"
"347","27.874652557","192.168.101.100","192.168.101.200","TCP","66","56694  >  1883 [ACK] Seq=68112 Ack=69 Win=502 Len=0 TSval=2288152939 TSecr=1826909906"
"348","28.350097707","192.168.101.200","192.168.101.100","TCP","70","[TCP Spurious Retransmission] 1883  >  56694 [PSH, ACK] Seq=65 Ack=68112 Win=1283 Len=4 TSval=1826910479 TSecr=2288152742"
"350","28.350339314","192.168.101.100","192.168.101.200","TCP","78","[TCP Dup ACK 347#1] 56694  >  1883 [ACK] Seq=68112 Ack=69 Win=502 Len=0 TSval=2288153414 TSecr=1826910479 SLE=65 SRE=69"
"356","28.619677756","192.168.101.100","192.168.101.200","TCP","1514","56694  >  1883 [ACK] Seq=68112 Ack=69 Win=502 Len=1448 TSval=2288153684 TSecr=1826910479"
"357","28.619860256","192.168.101.100","192.168.101.200","TCP","1514","56694  >  1883 [ACK] Seq=69560 Ack=69 Win=502 Len=1448 TSval=2288153684 TSecr=1826910479"
"358","28.619925436","192.168.101.100","192.168.101.200","TCP","1177","56694  >  1883 [PSH, ACK] Seq=71008 Ack=69 Win=502 Len=1111 TSval=2288153684 TSecr=1826910479"
"360","28.620897946","192.168.101.200","192.168.101.100","TCP","66","1883  >  56694 [ACK] Seq=69 Ack=71008 Win=1283 Len=0 TSval=1826910750 TSecr=2288153684"
"362","28.676445015","192.168.101.200","192.168.101.100","TCP","70","1883  >  56694 [PSH, ACK] Seq=69 Ack=72119 Win=1283 Len=4 TSval=1826910805 TSecr=2288153684"
"367","28.773075926","192.168.101.100","192.168.101.200","TCP","66","56694  >  1883 [ACK] Seq=72119 Ack=73 Win=502 Len=0 TSval=2288153837 TSecr=1826910805"
"368","29.117287310","192.168.101.200","192.168.101.100","TCP","70","[TCP Spurious Retransmission] 1883  >  56694 [PSH, ACK] Seq=69 Ack=72119 Win=1283 Len=4 TSval=1826911246 TSecr=2288153684"
"373","29.637416071","192.168.101.100","192.168.101.200","TCP","1514","56694  >  1883 [ACK] Seq=72119 Ack=73 Win=502 Len=1448 TSval=2288154702 TSecr=1826910805"
"374","29.637466845","192.168.101.100","192.168.101.200","TCP","1514","56694  >  1883 [ACK] Seq=73567 Ack=73 Win=502 Len=1448 TSval=2288154702 TSecr=1826910805"
"375","29.637509244","192.168.101.100","192.168.101.200","TCP","1177","56694  >  1883 [PSH, ACK] Seq=75015 Ack=73 Win=502 Len=1111 TSval=2288154702 TSecr=1826910805"
"378","29.679001790","192.168.101.200","192.168.101.100","TCP","78","1883  >  56694 [ACK] Seq=73 Ack=73567 Win=1274 Len=0 TSval=1826911808 TSecr=2288154702 SLE=75015 SRE=76126"
"380","29.795592591","192.168.101.100","192.168.101.200","TCP","1514","[TCP Retransmission] 56694  >  1883 [ACK] Seq=73567 Ack=73 Win=502 Len=1448 TSval=2288154860 TSecr=1826911808"
"382","29.796238518","192.168.101.200","192.168.101.100","TCP","66","1883  >  56694 [ACK] Seq=73 Ack=76126 Win=1267 Len=0 TSval=1826911925 TSecr=2288154860"
"383","29.796926937","192.168.101.200","192.168.101.100","TCP","70","1883  >  56694 [PSH, ACK] Seq=73 Ack=76126 Win=1283 Len=4 TSval=1826911926 TSecr=2288154860"
"389","30.671022993","192.168.101.100","192.168.101.200","TCP","1514","56694  >  1883 [ACK] Seq=76126 Ack=73 Win=502 Len=1448 TSval=2288155736 TSecr=1826911925"
"390","30.671127831","192.168.101.100","192.168.101.200","TCP","1514","56694  >  1883 [ACK] Seq=77574 Ack=73 Win=502 Len=1448 TSval=2288155736 TSecr=1826911925"
"393","30.681653437","192.168.101.200","192.168.101.100","TCP","66","1883  >  56694 [ACK] Seq=77 Ack=79022 Win=1283 Len=0 TSval=1826912811 TSecr=2288155736"
"395","30.681875220","192.168.101.100","192.168.101.200","TCP","1177","56694  >  1883 [PSH, ACK] Seq=79022 Ack=73 Win=502 Len=1111 TSval=2288155747 TSecr=1826911925"
"397","30.812244418","192.168.101.200","192.168.101.100","TCP","70","1883  >  56694 [PSH, ACK] Seq=77 Ack=80133 Win=1283 Len=4 TSval=1826912942 TSecr=2288155747"
"399","30.812433276","192.168.101.100","192.168.101.200","TCP","78","[TCP Dup ACK 367#1] 56694  >  1883 [ACK] Seq=80133 Ack=73 Win=502 Len=0 TSval=2288155877 TSecr=1826911925 SLE=77 SRE=81"
"401","30.812763743","192.168.101.200","192.168.101.100","TCP","70","[TCP Fast Retransmission] 1883  >  56694 [PSH, ACK] Seq=73 Ack=80133 Win=1283 Len=4 TSval=1826912942 TSecr=2288155877"
"403","30.812932692","192.168.101.100","192.168.101.200","TCP","66","56694  >  1883 [ACK] Seq=80133 Ack=81 Win=502 Len=0 TSval=2288155878 TSecr=1826912942"
"406","31.711965700","192.168.101.100","192.168.101.200","TCP","1514","56694  >  1883 [ACK] Seq=80133 Ack=81 Win=502 Len=1448 TSval=2288156777 TSecr=1826912942"
"407","31.712157114","192.168.101.100","192.168.101.200","TCP","1514","56694  >  1883 [ACK] Seq=81581 Ack=81 Win=502 Len=1448 TSval=2288156777 TSecr=1826912942"
"409","31.712660433","192.168.101.200","192.168.101.100","TCP","78","[TCP Dup ACK 397#1] 1883  >  56694 [ACK] Seq=81 Ack=80133 Win=1283 Len=0 TSval=1826913842 TSecr=2288155878 SLE=81581 SRE=83029"
"411","31.782376933","192.168.101.100","192.168.101.200","TCP","1177","56694  >  1883 [PSH, ACK] Seq=83029 Ack=81 Win=502 Len=1111 TSval=2288156847 TSecr=1826913842"
"413","31.783376775","192.168.101.200","192.168.101.100","TCP","78","[TCP Dup ACK 397#3] 1883  >  56694 [ACK] Seq=81 Ack=80133 Win=1283 Len=0 TSval=1826913913 TSecr=2288155878 SLE=81581 SRE=84140"
"414","31.795755886","192.168.101.100","192.168.101.200","TCP","1514","[TCP Fast Retransmission] 56694  >  1883 [ACK] Seq=80133 Ack=81 Win=502 Len=1448 TSval=2288156861 TSecr=1826913842"
"416","32.499430259","192.168.101.100","192.168.101.200","TCP","1514","[TCP Retransmission] 56694  >  1883 [ACK] Seq=80133 Ack=81 Win=502 Len=1448 TSval=2288157565 TSecr=1826913913"
"418","32.500149117","192.168.101.200","192.168.101.100","TCP","66","1883  >  56694 [ACK] Seq=81 Ack=84140 Win=1259 Len=0 TSval=1826914630 TSecr=2288157565"
"419","32.500904865","192.168.101.200","192.168.101.100","TCP","70","1883  >  56694 [PSH, ACK] Seq=81 Ack=84140 Win=1283 Len=4 TSval=1826914631 TSecr=2288157565"
"424","33.052102590","192.168.101.200","192.168.101.100","TCP","70","[TCP Retransmission] 1883  >  56694 [PSH, ACK] Seq=81 Ack=84140 Win=1283 Len=4 TSval=1826915182 TSecr=2288157565"
"429","33.715706063","192.168.101.100","192.168.101.200","TCP","1514","[TCP Spurious Retransmission] 56694  >  1883 [ACK] Seq=80133 Ack=81 Win=502 Len=1448 TSval=2288158781 TSecr=1826913913"
"431","33.716526640","192.168.101.200","192.168.101.100","TCP","78","[TCP Dup ACK 418#1] 1883  >  56694 [ACK] Seq=85 Ack=84140 Win=1283 Len=0 TSval=1826915847 TSecr=2288157565 SLE=80133 SRE=81581"
"433","33.716740283","192.168.101.100","192.168.101.200","TCP","1514","56694  >  1883 [ACK] Seq=84140 Ack=81 Win=502 Len=1448 TSval=2288158782 TSecr=1826913913"
"434","33.716782760","192.168.101.100","192.168.101.200","TCP","1514","56694  >  1883 [ACK] Seq=85588 Ack=81 Win=502 Len=1448 TSval=2288158782 TSecr=1826913913"
"436","33.717250149","192.168.101.200","192.168.101.100","TCP","66","1883  >  56694 [ACK] Seq=85 Ack=85588 Win=1274 Len=0 TSval=1826915847 TSecr=2288158782"
"438","33.879732820","192.168.101.100","192.168.101.200","TCP","1514","56694  >  1883 [ACK] Seq=87036 Ack=81 Win=502 Len=1448 TSval=2288158945 TSecr=1826913913"
"439","33.879760557","192.168.101.100","192.168.101.200","TCP","1514","56694  >  1883 [ACK] Seq=88484 Ack=81 Win=502 Len=1448 TSval=2288158945 TSecr=1826913913"
"441","33.982386103","192.168.101.200","192.168.101.100","TCP","78","[TCP Dup ACK 436#2] 1883  >  56694 [ACK] Seq=85 Ack=85588 Win=1274 Len=0 TSval=1826916113 TSecr=2288158782 SLE=88484 SRE=89932"
"443","34.082930918","192.168.101.100","192.168.101.200","TCP","1514","[TCP Fast Retransmission] 56694  >  1883 [ACK] Seq=85588 Ack=81 Win=502 Len=1448 TSval=2288159148 TSecr=1826913913"
"445","34.083532517","192.168.101.200","192.168.101.100","TCP","78","1883  >  56694 [ACK] Seq=85 Ack=87036 Win=1266 Len=0 TSval=1826916214 TSecr=2288159148 SLE=88484 SRE=89932"
"446","34.099520194","192.168.101.100","192.168.101.200","TCP","1514","[TCP Retransmission] 56694  >  1883 [ACK] Seq=87036 Ack=81 Win=502 Len=1448 TSval=2288159165 TSecr=1826913913"
"448","34.173630426","192.168.101.100","192.168.101.200","TCP","1514","56694  >  1883 [ACK] Seq=89932 Ack=81 Win=502 Len=1448 TSval=2288159239 TSecr=1826913913"
"449","34.173695027","192.168.101.200","192.168.101.100","TCP","66","1883  >  56694 [ACK] Seq=85 Ack=89932 Win=1267 Len=0 TSval=1826916304 TSecr=2288159165"
"451","34.180978251","192.168.101.200","192.168.101.100","TCP","70","1883  >  56694 [PSH, ACK] Seq=85 Ack=89932 Win=1283 Len=4 TSval=1826916311 TSecr=2288159165"
"453","34.271421496","192.168.101.100","192.168.101.200","TCP","840","56694  >  1883 [PSH, ACK] Seq=91380 Ack=81 Win=502 Len=774 TSval=2288159337 TSecr=1826913913"
"455","34.316429494","192.168.101.200","192.168.101.100","TCP","66","1883  >  56694 [ACK] Seq=89 Ack=91380 Win=1283 Len=0 TSval=1826916447 TSecr=2288159239"
"457","34.369350530","192.168.101.100","192.168.101.200","TCP","78","[TCP Dup ACK 403#2] 56694  >  1883 [ACK] Seq=92154 Ack=81 Win=502 Len=0 TSval=2288159435 TSecr=1826913913 SLE=85 SRE=89"
"459","34.369520033","192.168.101.200","192.168.101.100","TCP","66","1883  >  56694 [ACK] Seq=89 Ack=92154 Win=1277 Len=0 TSval=1826916500 TSecr=2288159337"
"461","34.427654957","192.168.101.200","192.168.101.100","TCP","70","1883  >  56694 [PSH, ACK] Seq=89 Ack=92154 Win=1283 Len=4 TSval=1826916558 TSecr=2288159337"
"467","34.467714828","192.168.101.100","192.168.101.200","TCP","78","[TCP Dup ACK 403#4] 56694  >  1883 [ACK] Seq=92154 Ack=81 Win=502 Len=0 TSval=2288159533 TSecr=1826913913 SLE=85 SRE=93"
"468","34.467789103","192.168.101.200","192.168.101.100","TCP","70","[TCP Fast Retransmission] 1883  >  56694 [PSH, ACK] Seq=81 Ack=92154 Win=1283 Len=4 TSval=1826916598 TSecr=2288159435"
"471","34.467958400","192.168.101.100","192.168.101.200","TCP","66","56694  >  1883 [ACK] Seq=92154 Ack=93 Win=502 Len=0 TSval=2288159534 TSecr=1826916598"
"479","34.776387517","192.168.101.100","192.168.101.200","TCP","1514","56694  >  1883 [ACK] Seq=92154 Ack=93 Win=502 Len=1448 TSval=2288159842 TSecr=1826916598"
"480","34.776439697","192.168.101.100","192.168.101.200","TCP","1514","56694  >  1883 [ACK] Seq=93602 Ack=93 Win=502 Len=1448 TSval=2288159842 TSecr=1826916598"
"481","34.776464017","192.168.101.100","192.168.101.200","TCP","1177","56694  >  1883 [PSH, ACK] Seq=95050 Ack=93 Win=502 Len=1111 TSval=2288159842 TSecr=1826916598"
"483","34.776889083","192.168.101.200","192.168.101.100","TCP","66","1883  >  56694 [ACK] Seq=93 Ack=95050 Win=1267 Len=0 TSval=1826916907 TSecr=2288159842"
"485","34.866717166","192.168.101.200","192.168.101.100","TCP","66","1883  >  56694 [ACK] Seq=93 Ack=96161 Win=1274 Len=0 TSval=1826916997 TSecr=2288159842"
"486","34.883799332","192.168.101.200","192.168.101.100","TCP","70","1883  >  56694 [PSH, ACK] Seq=93 Ack=96161 Win=1283 Len=4 TSval=1826917014 TSecr=2288159842"
"489","35.387843812","192.168.101.200","192.168.101.100","TCP","70","[TCP Retransmission] 1883  >  56694 [PSH, ACK] Seq=93 Ack=96161 Win=1283 Len=4 TSval=1826917518 TSecr=2288159842"
"491","35.388059668","192.168.101.100","192.168.101.200","TCP","66","56694  >  1883 [ACK] Seq=96161 Ack=97 Win=502 Len=0 TSval=2288160454 TSecr=1826917518"
"496","35.807455877","192.168.101.100","192.168.101.200","TCP","1514","56694  >  1883 [ACK] Seq=96161 Ack=97 Win=502 Len=1448 TSval=2288160873 TSecr=1826917518"
"497","35.807569989","192.168.101.100","192.168.101.200","TCP","1514","56694  >  1883 [ACK] Seq=97609 Ack=97 Win=502 Len=1448 TSval=2288160873 TSecr=1826917518"
"498","35.807656365","192.168.101.100","192.168.101.200","TCP","1177","56694  >  1883 [PSH, ACK] Seq=99057 Ack=97 Win=502 Len=1111 TSval=2288160873 TSecr=1826917518"
"500","35.808540546","192.168.101.200","192.168.101.100","TCP","66","1883  >  56694 [ACK] Seq=97 Ack=99057 Win=1283 Len=0 TSval=1826917939 TSecr=2288160873"
"502","36.595294524","192.168.101.100","192.168.101.200","TCP","1177","[TCP Retransmission] 56694  >  1883 [PSH, ACK] Seq=99057 Ack=97 Win=502 Len=1111 TSval=2288161661 TSecr=1826917939"
"504","36.601925711","192.168.101.200","192.168.101.100","TCP","70","1883  >  56694 [PSH, ACK] Seq=97 Ack=100168 Win=1283 Len=4 TSval=1826918733 TSecr=2288161661"
"506","36.816372031","192.168.101.100","192.168.101.200","TCP","1514","56694  >  1883 [ACK] Seq=100168 Ack=97 Win=502 Len=1448 TSval=2288161883 TSecr=1826917939"
"507","36.816423310","192.168.101.100","192.168.101.200","TCP","1514","56694  >  1883 [ACK] Seq=101616 Ack=97 Win=502 Len=1448 TSval=2288161883 TSecr=1826917939"
"508","37.267008930","192.168.101.100","192.168.101.200","TCP","1177","56694  >  1883 [PSH, ACK] Seq=103064 Ack=97 Win=502 Len=1111 TSval=2288162333 TSecr=1826917939"
"510","37.267718616","192.168.101.200","192.168.101.100","TCP","78","[TCP Dup ACK 504#1] 1883  >  56694 [ACK] Seq=101 Ack=100168 Win=1283 Len=0 TSval=1826919399 TSecr=2288161661 SLE=103064 SRE=104175"
"515","37.758685780","192.168.101.200","192.168.101.100","TCP","82","[TCP Retransmission] 1883  >  56694 [PSH, ACK] Seq=97 Ack=100168 Win=1283 Len=4 TSval=1826919890 TSecr=2288161661 SLE=103064 SRE=104175"
"517","37.759177480","192.168.101.100","192.168.101.200","TCP","66","56694  >  1883 [ACK] Seq=104175 Ack=101 Win=502 Len=0 TSval=2288162826 TSecr=1826919890"
"519","37.846125603","192.168.101.100","192.168.101.200","TCP","1514","56694  >  1883 [ACK] Seq=104175 Ack=101 Win=502 Len=1448 TSval=2288162913 TSecr=1826919890"
"521","37.846498684","192.168.101.200","192.168.101.100","TCP","78","[TCP Dup ACK 504#2] 1883  >  56694 [ACK] Seq=101 Ack=100168 Win=1283 Len=0 TSval=1826919978 TSecr=2288161661 SLE=103064 SRE=105623"
"523","37.846637927","192.168.101.100","192.168.101.200","TCP","1514","[TCP Fast Retransmission] 56694  >  1883 [ACK] Seq=100168 Ack=101 Win=502 Len=1448 TSval=2288162913 TSecr=1826919978"
"525","37.846907094","192.168.101.200","192.168.101.100","TCP","78","1883  >  56694 [ACK] Seq=101 Ack=101616 Win=1272 Len=0 TSval=1826919978 TSecr=2288162913 SLE=103064 SRE=105623"
"527","37.872131475","192.168.101.100","192.168.101.200","TCP","1514","[TCP Retransmission] 56694  >  1883 [ACK] Seq=101616 Ack=101 Win=502 Len=1448 TSval=2288162939 TSecr=1826919978"
"528","37.872214547","192.168.101.100","192.168.101.200","TCP","1514","56694  >  1883 [ACK] Seq=105623 Ack=101 Win=502 Len=1448 TSval=2288162939 TSecr=1826919978"
"530","37.872790917","192.168.101.200","192.168.101.100","TCP","66","1883  >  56694 [ACK] Seq=101 Ack=105623 Win=1259 Len=0 TSval=1826920004 TSecr=2288162939"
"531","37.874724792","192.168.101.200","192.168.101.100","TCP","70","1883  >  56694 [PSH, ACK] Seq=101 Ack=105623 Win=1283 Len=4 TSval=1826920006 TSecr=2288162939"
"533","38.014846228","192.168.101.200","192.168.101.100","TCP","66","1883  >  56694 [ACK] Seq=105 Ack=107071 Win=1283 Len=0 TSval=1826920146 TSecr=2288162939"
"535","38.064988056","192.168.101.100","192.168.101.200","TCP","1177","56694  >  1883 [PSH, ACK] Seq=107071 Ack=101 Win=502 Len=1111 TSval=2288163132 TSecr=1826920004"
"537","38.065042864","192.168.101.100","192.168.101.200","TCP","66","56694  >  1883 [ACK] Seq=108182 Ack=105 Win=502 Len=0 TSval=2288163132 TSecr=1826920006"
"539","38.065381904","192.168.101.200","192.168.101.100","TCP","66","1883  >  56694 [ACK] Seq=105 Ack=108182 Win=1275 Len=0 TSval=1826920197 TSecr=2288163132"
"540","38.074019515","192.168.101.200","192.168.101.100","TCP","70","1883  >  56694 [PSH, ACK] Seq=105 Ack=108182 Win=1283 Len=4 TSval=1826920205 TSecr=2288163132"
"544","38.162976286","192.168.101.100","192.168.101.200","TCP","66","56694  >  1883 [ACK] Seq=108182 Ack=109 Win=502 Len=0 TSval=2288163230 TSecr=1826920205"
"550","38.869016562","192.168.101.100","192.168.101.200","TCP","1514","56694  >  1883 [ACK] Seq=108182 Ack=109 Win=502 Len=1448 TSval=2288163936 TSecr=1826920205"
"551","38.869058343","192.168.101.100","192.168.101.200","TCP","1514","56694  >  1883 [ACK] Seq=109630 Ack=109 Win=502 Len=1448 TSval=2288163936 TSecr=1826920205"
"552","38.869081634","192.168.101.100","192.168.101.200","TCP","1177","56694  >  1883 [PSH, ACK] Seq=111078 Ack=109 Win=502 Len=1111 TSval=2288163936 TSecr=1826920205"
"554","38.869754410","192.168.101.200","192.168.101.100","TCP","66","1883  >  56694 [ACK] Seq=109 Ack=111078 Win=1283 Len=0 TSval=1826921001 TSecr=2288163936"
"556","38.967949674","192.168.101.200","192.168.101.100","TCP","70","1883  >  56694 [PSH, ACK] Seq=109 Ack=112189 Win=1283 Len=4 TSval=1826921099 TSecr=2288163936"
"559","39.060936885","192.168.101.100","192.168.101.200","TCP","66","56694  >  1883 [ACK] Seq=112189 Ack=113 Win=502 Len=0 TSval=2288164128 TSecr=1826921099"
"565","39.893365899","192.168.101.100","192.168.101.200","TCP","1514","56694  >  1883 [ACK] Seq=112189 Ack=113 Win=502 Len=1448 TSval=2288164960 TSecr=1826921099"
"566","39.893479424","192.168.101.100","192.168.101.200","TCP","1514","56694  >  1883 [ACK] Seq=113637 Ack=113 Win=502 Len=1448 TSval=2288164960 TSecr=1826921099"
