"No.","Time","Source","Destination","Length","Info"
"287","20.155323777","192.168.101.100","192.168.101.200","1514","43352  >  2014 [ACK] Seq=1 Ack=1 Win=501 Len=1448 TSval=3395022148 TSecr=2668486999"
"288","20.155451391","192.168.101.100","192.168.101.200","164","43352  >  2014 [PSH, ACK] Seq=1449 Ack=1 Win=501 Len=98 TSval=3395022148 TSecr=2668486999"
"290","20.155939576","192.168.101.200","192.168.101.100","78","2014  >  43352 [ACK] Seq=1 Ack=1 Win=1396 Len=0 TSval=2668764381 TSecr=3394744766 SLE=1449 SRE=1547"
"292","20.253554593","192.168.101.100","192.168.101.200","1514","[TCP Retransmission] 43352  >  2014 [ACK] Seq=1 Ack=1 Win=501 Len=1448 TSval=3395022246 TSecr=2668764381"
"294","20.254226269","192.168.101.200","192.168.101.100","66","2014  >  43352 [ACK] Seq=1 Ack=1547 Win=1388 Len=0 TSval=2668764479 TSecr=3395022246"
"314","21.163430533","192.168.101.100","192.168.101.200","1514","43352  >  2014 [ACK] Seq=1547 Ack=1 Win=501 Len=1448 TSval=3395023156 TSecr=2668764479"
"315","21.163538266","192.168.101.100","192.168.101.200","164","43352  >  2014 [PSH, ACK] Seq=2995 Ack=1 Win=501 Len=98 TSval=3395023156 TSecr=2668764479"
"317","21.164090600","192.168.101.200","192.168.101.100","66","2014  >  43352 [ACK] Seq=1 Ack=2995 Win=1391 Len=0 TSval=2668765389 TSecr=3395023156"
"320","21.192185452","192.168.101.200","192.168.101.100","66","2014  >  43352 [ACK] Seq=1 Ack=3093 Win=1396 Len=0 TSval=2668765417 TSecr=3395023156"
"335","22.168448068","192.168.101.100","192.168.101.200","1514","43352  >  2014 [ACK] Seq=3093 Ack=1 Win=501 Len=1448 TSval=3395024161 TSecr=2668765417"
"336","22.168504334","192.168.101.100","192.168.101.200","164","43352  >  2014 [PSH, ACK] Seq=4541 Ack=1 Win=501 Len=98 TSval=3395024161 TSecr=2668765417"
"338","22.168889406","192.168.101.200","192.168.101.100","66","2014  >  43352 [ACK] Seq=1 Ack=4541 Win=1391 Len=0 TSval=2668766394 TSecr=3395024161"
"344","22.450006778","192.168.101.100","192.168.101.200","164","[TCP Retransmission] 43352  >  2014 [PSH, ACK] Seq=4541 Ack=1 Win=501 Len=98 TSval=3395024443 TSecr=2668766394"
"347","22.701802014","192.168.101.100","192.168.101.200","164","[TCP Retransmission] 43352  >  2014 [PSH, ACK] Seq=4541 Ack=1 Win=501 Len=98 TSval=3395024694 TSecr=2668766394"
"349","22.702703051","192.168.101.200","192.168.101.100","66","2014  >  43352 [ACK] Seq=1 Ack=4639 Win=1396 Len=0 TSval=2668766928 TSecr=3395024694"
"356","23.176005421","192.168.101.100","192.168.101.200","1514","43352  >  2014 [ACK] Seq=4639 Ack=1 Win=501 Len=1448 TSval=3395025169 TSecr=2668766928"
"357","23.176084918","192.168.101.100","192.168.101.200","164","43352  >  2014 [PSH, ACK] Seq=6087 Ack=1 Win=501 Len=98 TSval=3395025169 TSecr=2668766928"
"359","23.176535284","192.168.101.200","192.168.101.100","66","2014  >  43352 [ACK] Seq=1 Ack=6185 Win=1388 Len=0 TSval=2668767402 TSecr=3395025169"
"373","24.184506340","192.168.101.100","192.168.101.200","1514","43352  >  2014 [ACK] Seq=6185 Ack=1 Win=501 Len=1448 TSval=3395026177 TSecr=2668767402"
"374","24.184557809","192.168.101.100","192.168.101.200","164","43352  >  2014 [PSH, ACK] Seq=7633 Ack=1 Win=501 Len=98 TSval=3395026177 TSecr=2668767402"
"376","24.185034321","192.168.101.200","192.168.101.100","78","[TCP Window Update] 2014  >  43352 [ACK] Seq=1 Ack=6185 Win=1396 Len=0 TSval=2668768410 TSecr=3395025169 SLE=7633 SRE=7731"
"379","24.242304622","192.168.101.100","192.168.101.200","1514","[TCP Retransmission] 43352  >  2014 [ACK] Seq=6185 Ack=1 Win=501 Len=1448 TSval=3395026235 TSecr=2668768410"
"381","24.243077482","192.168.101.200","192.168.101.100","66","2014  >  43352 [ACK] Seq=1 Ack=7731 Win=1388 Len=0 TSval=2668768468 TSecr=3395026235"
"392","25.193807675","192.168.101.100","192.168.101.200","1514","43352  >  2014 [ACK] Seq=7731 Ack=1 Win=501 Len=1448 TSval=3395027186 TSecr=2668768468"
"393","25.193888969","192.168.101.100","192.168.101.200","164","43352  >  2014 [PSH, ACK] Seq=9179 Ack=1 Win=501 Len=98 TSval=3395027186 TSecr=2668768468"
"395","25.194277389","192.168.101.200","192.168.101.100","66","2014  >  43352 [ACK] Seq=1 Ack=9179 Win=1391 Len=0 TSval=2668769419 TSecr=3395027186"
"400","25.434134778","192.168.101.100","192.168.101.200","164","[TCP Retransmission] 43352  >  2014 [PSH, ACK] Seq=9179 Ack=1 Win=501 Len=98 TSval=3395027427 TSecr=2668769419"
"402","25.434715043","192.168.101.200","192.168.101.100","66","2014  >  43352 [ACK] Seq=1 Ack=9277 Win=1396 Len=0 TSval=2668769660 TSecr=3395027427"
"416","26.206620196","192.168.101.100","192.168.101.200","1514","43352  >  2014 [ACK] Seq=9277 Ack=1 Win=501 Len=1448 TSval=3395028199 TSecr=2668769660"
"417","26.206679863","192.168.101.100","192.168.101.200","164","43352  >  2014 [PSH, ACK] Seq=10725 Ack=1 Win=501 Len=98 TSval=3395028199 TSecr=2668769660"
"419","26.207161003","192.168.101.200","192.168.101.100","78","[TCP Dup ACK 402#2] 2014  >  43352 [ACK] Seq=1 Ack=9277 Win=1396 Len=0 TSval=2668770432 TSecr=3395027427 SLE=10725 SRE=10823"
"424","26.446033589","192.168.101.100","192.168.101.200","1514","[TCP Retransmission] 43352  >  2014 [ACK] Seq=9277 Ack=1 Win=501 Len=1448 TSval=3395028438 TSecr=2668769660"
"426","26.446721325","192.168.101.200","192.168.101.100","66","2014  >  43352 [ACK] Seq=1 Ack=10823 Win=1388 Len=0 TSval=2668770672 TSecr=3395028438"
"436","27.209135950","192.168.101.100","192.168.101.200","1514","43352  >  2014 [ACK] Seq=10823 Ack=1 Win=501 Len=1448 TSval=3395029202 TSecr=2668770672"
"437","27.209240170","192.168.101.100","192.168.101.200","164","43352  >  2014 [PSH, ACK] Seq=12271 Ack=1 Win=501 Len=98 TSval=3395029202 TSecr=2668770672"
"439","27.209611868","192.168.101.200","192.168.101.100","66","2014  >  43352 [ACK] Seq=1 Ack=12369 Win=1388 Len=0 TSval=2668771435 TSecr=3395029202"
"441","27.276214637","192.168.101.100","192.168.101.200","164","[TCP Spurious Retransmission] 43352  >  2014 [PSH, ACK] Seq=12271 Ack=1 Win=501 Len=98 TSval=3395029269 TSecr=2668770672"
"446","27.318224466","192.168.101.200","192.168.101.100","78","[TCP Window Update] 2014  >  43352 [ACK] Seq=1 Ack=12369 Win=1399 Len=0 TSval=2668771543 TSecr=3395029269 SLE=12271 SRE=12369"
"457","28.215621553","192.168.101.100","192.168.101.200","1604","43352  >  2014 [PSH, ACK] Seq=12369 Ack=1 Win=501 Len=1538 TSval=3395030208 TSecr=2668771543"
"459","28.216094459","192.168.101.200","192.168.101.100","66","2014  >  43352 [ACK] Seq=1 Ack=13907 Win=1388 Len=0 TSval=2668772441 TSecr=3395030208"
"473","29.223668326","192.168.101.100","192.168.101.200","1612","43352  >  2014 [PSH, ACK] Seq=13907 Ack=1 Win=501 Len=1546 TSval=3395031216 TSecr=2668772441"
"475","29.224123206","192.168.101.200","192.168.101.100","66","2014  >  43352 [ACK] Seq=1 Ack=15355 Win=1391 Len=0 TSval=2668773449 TSecr=3395031216"
"480","29.557654419","192.168.101.100","192.168.101.200","164","[TCP Retransmission] 43352  >  2014 [PSH, ACK] Seq=15355 Ack=1 Win=501 Len=98 TSval=3395031550 TSecr=2668773449"
"483","29.558311761","192.168.101.200","192.168.101.100","66","2014  >  43352 [ACK] Seq=1 Ack=15453 Win=1396 Len=0 TSval=2668773783 TSecr=3395031550"
"492","30.231424940","192.168.101.100","192.168.101.200","1612","43352  >  2014 [PSH, ACK] Seq=15453 Ack=1 Win=501 Len=1546 TSval=3395032224 TSecr=2668773783"
"494","30.231870418","192.168.101.200","192.168.101.100","66","2014  >  43352 [ACK] Seq=1 Ack=16901 Win=1391 Len=0 TSval=2668774457 TSecr=3395032224"
"500","30.537272834","192.168.101.100","192.168.101.200","164","[TCP Retransmission] 43352  >  2014 [PSH, ACK] Seq=16901 Ack=1 Win=501 Len=98 TSval=3395032530 TSecr=2668774457"
"504","30.785995373","192.168.101.100","192.168.101.200","164","[TCP Retransmission] 43352  >  2014 [PSH, ACK] Seq=16901 Ack=1 Win=501 Len=98 TSval=3395032778 TSecr=2668774457"
"506","30.786614600","192.168.101.200","192.168.101.100","66","2014  >  43352 [ACK] Seq=1 Ack=16999 Win=1396 Len=0 TSval=2668775011 TSecr=3395032778"
"517","31.238906106","192.168.101.100","192.168.101.200","1514","43352  >  2014 [ACK] Seq=16999 Ack=1 Win=501 Len=1448 TSval=3395033231 TSecr=2668775011"
"518","31.238964088","192.168.101.100","192.168.101.200","164","43352  >  2014 [PSH, ACK] Seq=18447 Ack=1 Win=501 Len=98 TSval=3395033231 TSecr=2668775011"
"522","31.290660290","192.168.101.200","192.168.101.100","78","[TCP Dup ACK 506#2] 2014  >  43352 [ACK] Seq=1 Ack=16999 Win=1396 Len=0 TSval=2668775515 TSecr=3395032778 SLE=18447 SRE=18545"
"526","31.342204524","192.168.101.100","192.168.101.200","1514","[TCP Retransmission] 43352  >  2014 [ACK] Seq=16999 Ack=1 Win=501 Len=1448 TSval=3395033334 TSecr=2668775515"
"528","31.342657658","192.168.101.200","192.168.101.100","66","2014  >  43352 [ACK] Seq=1 Ack=18545 Win=1388 Len=0 TSval=2668775567 TSecr=3395033334"
"541","32.246762809","192.168.101.100","192.168.101.200","1514","43352  >  2014 [ACK] Seq=18545 Ack=1 Win=501 Len=1448 TSval=3395034239 TSecr=2668775567"
"542","32.246830348","192.168.101.100","192.168.101.200","164","43352  >  2014 [PSH, ACK] Seq=19993 Ack=1 Win=501 Len=98 TSval=3395034239 TSecr=2668775567"
"544","32.247186949","192.168.101.200","192.168.101.100","66","2014  >  43352 [ACK] Seq=1 Ack=19993 Win=1391 Len=0 TSval=2668776472 TSecr=3395034239"
"549","32.290212672","192.168.101.200","192.168.101.100","66","2014  >  43352 [ACK] Seq=1 Ack=20091 Win=1396 Len=0 TSval=2668776515 TSecr=3395034239"
"552","32.538030897","192.168.101.100","192.168.101.200","164","[TCP Spurious Retransmission] 43352  >  2014 [PSH, ACK] Seq=19993 Ack=1 Win=501 Len=98 TSval=3395034530 TSecr=2668776472"
"554","32.538672090","192.168.101.200","192.168.101.100","78","[TCP Window Update] 2014  >  43352 [ACK] Seq=1 Ack=20091 Win=1399 Len=0 TSval=2668776763 TSecr=3395034530 SLE=19993 SRE=20091"
"558","33.253980816","192.168.101.100","192.168.101.200","1612","43352  >  2014 [PSH, ACK] Seq=20091 Ack=1 Win=501 Len=1546 TSval=3395035246 TSecr=2668776763"
"560","33.254465917","192.168.101.200","192.168.101.100","66","2014  >  43352 [ACK] Seq=1 Ack=21539 Win=1391 Len=0 TSval=2668777479 TSecr=3395035246"
"567","33.525308866","192.168.101.100","192.168.101.200","164","[TCP Retransmission] 43352  >  2014 [PSH, ACK] Seq=21539 Ack=1 Win=501 Len=98 TSval=3395035518 TSecr=2668777479"
"569","33.525963747","192.168.101.200","192.168.101.100","66","2014  >  43352 [ACK] Seq=1 Ack=21637 Win=1396 Len=0 TSval=2668777751 TSecr=3395035518"
"579","34.260959278","192.168.101.100","192.168.101.200","1612","43352  >  2014 [PSH, ACK] Seq=21637 Ack=1 Win=501 Len=1546 TSval=3395036253 TSecr=2668777751"
"581","34.261537773","192.168.101.200","192.168.101.100","78","[TCP Dup ACK 569#2] 2014  >  43352 [ACK] Seq=1 Ack=21637 Win=1396 Len=0 TSval=2668778486 TSecr=3395035518 SLE=23085 SRE=23183"
"591","34.333577471","192.168.101.100","192.168.101.200","1514","[TCP Retransmission] 43352  >  2014 [ACK] Seq=21637 Ack=1 Win=501 Len=1448 TSval=3395036326 TSecr=2668778486"
"593","34.334176194","192.168.101.200","192.168.101.100","66","2014  >  43352 [ACK] Seq=1 Ack=23183 Win=1388 Len=0 TSval=2668778559 TSecr=3395036326"
"603","35.268516551","192.168.101.100","192.168.101.200","1514","43352  >  2014 [ACK] Seq=23183 Ack=1 Win=501 Len=1448 TSval=3395037261 TSecr=2668778559"
"604","35.268584970","192.168.101.100","192.168.101.200","164","43352  >  2014 [PSH, ACK] Seq=24631 Ack=1 Win=501 Len=98 TSval=3395037261 TSecr=2668778559"
"606","35.269012277","192.168.101.200","192.168.101.100","66","2014  >  43352 [ACK] Seq=1 Ack=24631 Win=1391 Len=0 TSval=2668779494 TSecr=3395037261"
"609","35.289189964","192.168.101.200","192.168.101.100","66","2014  >  43352 [ACK] Seq=1 Ack=24729 Win=1396 Len=0 TSval=2668779514 TSecr=3395037261"
"615","35.529635241","192.168.101.100","192.168.101.200","164","[TCP Retransmission] 43352  >  2014 [PSH, ACK] Seq=24631 Ack=1 Win=501 Len=98 TSval=3395037522 TSecr=2668779494"
"617","35.530292079","192.168.101.200","192.168.101.100","78","2014  >  43352 [ACK] Seq=1 Ack=24729 Win=1399 Len=0 TSval=2668779755 TSecr=3395037522 SLE=24631 SRE=24729"
"627","36.275102108","192.168.101.100","192.168.101.200","1612","43352  >  2014 [PSH, ACK] Seq=24729 Ack=1 Win=501 Len=1546 TSval=3395038267 TSecr=2668779755"
"629","36.275545107","192.168.101.200","192.168.101.100","66","2014  >  43352 [ACK] Seq=1 Ack=26177 Win=1391 Len=0 TSval=2668780500 TSecr=3395038267"
"634","36.287561708","192.168.101.200","192.168.101.100","66","2014  >  43352 [ACK] Seq=1 Ack=26275 Win=1396 Len=0 TSval=2668780512 TSecr=3395038267"
"646","37.283212741","192.168.101.100","192.168.101.200","1612","43352  >  2014 [PSH, ACK] Seq=26275 Ack=1 Win=501 Len=1546 TSval=3395039275 TSecr=2668780512"
"648","37.283678581","192.168.101.200","192.168.101.100","78","[TCP Dup ACK 634#2] 2014  >  43352 [ACK] Seq=1 Ack=26275 Win=1396 Len=0 TSval=2668781508 TSecr=3395038267 SLE=27723 SRE=27821"
"654","37.336023286","192.168.101.100","192.168.101.200","1514","[TCP Retransmission] 43352  >  2014 [ACK] Seq=26275 Ack=1 Win=501 Len=1448 TSval=3395039328 TSecr=2668781508"
"657","37.337123677","192.168.101.200","192.168.101.100","66","2014  >  43352 [ACK] Seq=1 Ack=27821 Win=1388 Len=0 TSval=2668781561 TSecr=3395039328"
"673","38.298313762","192.168.101.100","192.168.101.200","1514","43352  >  2014 [ACK] Seq=27821 Ack=1 Win=501 Len=1448 TSval=3395040290 TSecr=2668781561"
"674","38.298378175","192.168.101.100","192.168.101.200","164","43352  >  2014 [PSH, ACK] Seq=29269 Ack=1 Win=501 Len=98 TSval=3395040290 TSecr=2668781561"
"676","38.298876452","192.168.101.200","192.168.101.100","66","2014  >  43352 [ACK] Seq=1 Ack=29367 Win=1388 Len=0 TSval=2668782523 TSecr=3395040290"
"678","38.365284902","192.168.101.100","192.168.101.200","164","[TCP Spurious Retransmission] 43352  >  2014 [PSH, ACK] Seq=29269 Ack=1 Win=501 Len=98 TSval=3395040357 TSecr=2668781561"
"683","38.389152447","192.168.101.200","192.168.101.100","78","[TCP Window Update] 2014  >  43352 [ACK] Seq=1 Ack=29367 Win=1399 Len=0 TSval=2668782614 TSecr=3395040357 SLE=29269 SRE=29367"
"697","39.300957583","192.168.101.100","192.168.101.200","1612","43352  >  2014 [PSH, ACK] Seq=29367 Ack=1 Win=501 Len=1546 TSval=3395041293 TSecr=2668782614"
"699","39.301640597","192.168.101.200","192.168.101.100","66","2014  >  43352 [ACK] Seq=1 Ack=30815 Win=1391 Len=0 TSval=2668783526 TSecr=3395041293"
"701","39.381722761","192.168.101.100","192.168.101.200","164","[TCP Retransmission] 43352  >  2014 [PSH, ACK] Seq=30815 Ack=1 Win=501 Len=98 TSval=3395041374 TSecr=2668782614"
"704","39.390200199","192.168.101.200","192.168.101.100","66","2014  >  43352 [ACK] Seq=1 Ack=30913 Win=1396 Len=0 TSval=2668783615 TSecr=3395041374"
"710","40.306040049","192.168.101.100","192.168.101.200","1612","43352  >  2014 [PSH, ACK] Seq=30913 Ack=1 Win=501 Len=1546 TSval=3395042298 TSecr=2668783615"
"712","40.306510955","192.168.101.200","192.168.101.100","66","2014  >  43352 [ACK] Seq=1 Ack=32459 Win=1388 Len=0 TSval=2668784531 TSecr=3395042298"
"730","41.315718217","192.168.101.100","192.168.101.200","1514","43352  >  2014 [ACK] Seq=32459 Ack=1 Win=501 Len=1448 TSval=3395043308 TSecr=2668784531"
"731","41.315822325","192.168.101.100","192.168.101.200","164","43352  >  2014 [PSH, ACK] Seq=33907 Ack=1 Win=501 Len=98 TSval=3395043308 TSecr=2668784531"
"733","41.316311898","192.168.101.200","192.168.101.100","66","2014  >  43352 [ACK] Seq=1 Ack=33907 Win=1391 Len=0 TSval=2668785541 TSecr=3395043308"
"737","41.385731363","192.168.101.200","192.168.101.100","66","2014  >  43352 [ACK] Seq=1 Ack=34005 Win=1396 Len=0 TSval=2668785610 TSecr=3395043308"
"744","42.323628570","192.168.101.100","192.168.101.200","1514","43352  >  2014 [ACK] Seq=34005 Ack=1 Win=501 Len=1448 TSval=3395044316 TSecr=2668785610"
"745","42.323668597","192.168.101.100","192.168.101.200","164","43352  >  2014 [PSH, ACK] Seq=35453 Ack=1 Win=501 Len=98 TSval=3395044316 TSecr=2668785610"
"747","42.324138737","192.168.101.200","192.168.101.100","66","2014  >  43352 [ACK] Seq=1 Ack=35453 Win=1391 Len=0 TSval=2668786549 TSecr=3395044316"
"760","42.641331864","192.168.101.100","192.168.101.200","164","[TCP Retransmission] 43352  >  2014 [PSH, ACK] Seq=35453 Ack=1 Win=501 Len=98 TSval=3395044633 TSecr=2668786549"
"762","42.641980778","192.168.101.200","192.168.101.100","66","2014  >  43352 [ACK] Seq=1 Ack=35551 Win=1396 Len=0 TSval=2668786866 TSecr=3395044633"
"772","43.332176993","192.168.101.100","192.168.101.200","1514","43352  >  2014 [ACK] Seq=35551 Ack=1 Win=501 Len=1448 TSval=3395045324 TSecr=2668786866"
"773","43.332216352","192.168.101.100","192.168.101.200","164","43352  >  2014 [PSH, ACK] Seq=36999 Ack=1 Win=501 Len=98 TSval=3395045324 TSecr=2668786866"
"775","43.332628978","192.168.101.200","192.168.101.100","66","2014  >  43352 [ACK] Seq=1 Ack=36999 Win=1391 Len=0 TSval=2668787557 TSecr=3395045324"
"778","43.386088174","192.168.101.200","192.168.101.100","66","2014  >  43352 [ACK] Seq=1 Ack=37097 Win=1396 Len=0 TSval=2668787610 TSecr=3395045324"
"784","43.637824662","192.168.101.100","192.168.101.200","164","[TCP Spurious Retransmission] 43352  >  2014 [PSH, ACK] Seq=36999 Ack=1 Win=501 Len=98 TSval=3395045630 TSecr=2668787557"
"786","43.638478272","192.168.101.200","192.168.101.100","78","[TCP Window Update] 2014  >  43352 [ACK] Seq=1 Ack=37097 Win=1399 Len=0 TSval=2668787863 TSecr=3395045630 SLE=36999 SRE=37097"
"791","43.889416481","192.168.101.100","192.168.101.200","164","[TCP Spurious Retransmission] 43352  >  2014 [PSH, ACK] Seq=36999 Ack=1 Win=501 Len=98 TSval=3395045881 TSecr=2668787557"
"793","43.890159852","192.168.101.200","192.168.101.100","78","[TCP Dup ACK 778#1] 2014  >  43352 [ACK] Seq=1 Ack=37097 Win=1399 Len=0 TSval=2668788114 TSecr=3395045881 SLE=36999 SRE=37097"
"799","44.350881822","192.168.101.100","192.168.101.200","1514","43352  >  2014 [ACK] Seq=37097 Ack=1 Win=501 Len=1448 TSval=3395046343 TSecr=2668788114"
"800","44.350932535","192.168.101.100","192.168.101.200","164","43352  >  2014 [PSH, ACK] Seq=38545 Ack=1 Win=501 Len=98 TSval=3395046343 TSecr=2668788114"
"802","44.351378451","192.168.101.200","192.168.101.100","66","2014  >  43352 [ACK] Seq=1 Ack=38545 Win=1391 Len=0 TSval=2668788576 TSecr=3395046343"
"805","44.387879781","192.168.101.200","192.168.101.100","66","2014  >  43352 [ACK] Seq=1 Ack=38643 Win=1396 Len=0 TSval=2668788612 TSecr=3395046343"
"818","45.362811154","192.168.101.100","192.168.101.200","1514","43352  >  2014 [ACK] Seq=38643 Ack=1 Win=501 Len=1448 TSval=3395047355 TSecr=2668788612"
"819","45.362924229","192.168.101.100","192.168.101.200","164","43352  >  2014 [PSH, ACK] Seq=40091 Ack=1 Win=501 Len=98 TSval=3395047355 TSecr=2668788612"
"821","45.363320691","192.168.101.200","192.168.101.100","66","2014  >  43352 [ACK] Seq=1 Ack=40091 Win=1391 Len=0 TSval=2668789588 TSecr=3395047355"
"831","45.629687011","192.168.101.100","192.168.101.200","164","[TCP Retransmission] 43352  >  2014 [PSH, ACK] Seq=40091 Ack=1 Win=501 Len=98 TSval=3395047621 TSecr=2668789588"
"833","45.630225528","192.168.101.200","192.168.101.100","66","2014  >  43352 [ACK] Seq=1 Ack=40189 Win=1396 Len=0 TSval=2668789854 TSecr=3395047621"
"839","46.365610076","192.168.101.100","192.168.101.200","1514","43352  >  2014 [ACK] Seq=40189 Ack=1 Win=501 Len=1448 TSval=3395048357 TSecr=2668789854"
"840","46.365684404","192.168.101.100","192.168.101.200","164","43352  >  2014 [PSH, ACK] Seq=41637 Ack=1 Win=501 Len=98 TSval=3395048357 TSecr=2668789854"
"842","46.366068853","192.168.101.200","192.168.101.100","66","2014  >  43352 [ACK] Seq=1 Ack=41637 Win=1391 Len=0 TSval=2668790590 TSecr=3395048357"
"855","46.629862589","192.168.101.100","192.168.101.200","164","[TCP Retransmission] 43352  >  2014 [PSH, ACK] Seq=41637 Ack=1 Win=501 Len=98 TSval=3395048622 TSecr=2668790590"
"857","46.630455204","192.168.101.200","192.168.101.100","66","2014  >  43352 [ACK] Seq=1 Ack=41735 Win=1396 Len=0 TSval=2668790855 TSecr=3395048622"
"863","47.379754686","192.168.101.100","192.168.101.200","1514","43352  >  2014 [ACK] Seq=41735 Ack=1 Win=501 Len=1448 TSval=3395049372 TSecr=2668790855"
"864","47.379805700","192.168.101.100","192.168.101.200","164","43352  >  2014 [PSH, ACK] Seq=43183 Ack=1 Win=501 Len=98 TSval=3395049372 TSecr=2668790855"
"866","47.380231158","192.168.101.200","192.168.101.100","78","[TCP Dup ACK 857#2] 2014  >  43352 [ACK] Seq=1 Ack=41735 Win=1396 Len=0 TSval=2668791605 TSecr=3395048622 SLE=43183 SRE=43281"
"873","47.617400427","192.168.101.100","192.168.101.200","1514","[TCP Retransmission] 43352  >  2014 [ACK] Seq=41735 Ack=1 Win=501 Len=1448 TSval=3395049609 TSecr=2668790855"
"875","48.085403710","192.168.101.100","192.168.101.200","1514","[TCP Retransmission] 43352  >  2014 [ACK] Seq=41735 Ack=1 Win=501 Len=1448 TSval=3395050077 TSecr=2668790855"
"877","48.085981819","192.168.101.200","192.168.101.100","66","2014  >  43352 [ACK] Seq=1 Ack=43281 Win=1388 Len=0 TSval=2668792310 TSecr=3395050077"
"879","48.389143957","192.168.101.100","192.168.101.200","1514","43352  >  2014 [ACK] Seq=43281 Ack=1 Win=501 Len=1448 TSval=3395050381 TSecr=2668792310"
"880","48.389201751","192.168.101.100","192.168.101.200","160","43352  >  2014 [PSH, ACK] Seq=44729 Ack=1 Win=501 Len=94 TSval=3395050381 TSecr=2668792310"
"882","48.389609382","192.168.101.200","192.168.101.100","66","2014  >  43352 [ACK] Seq=1 Ack=44729 Win=1391 Len=0 TSval=2668792614 TSecr=3395050381"
"884","48.454004118","192.168.101.100","192.168.101.200","160","[TCP Retransmission] 43352  >  2014 [PSH, ACK] Seq=44729 Ack=1 Win=501 Len=94 TSval=3395050446 TSecr=2668792310"
"886","48.454763008","192.168.101.200","192.168.101.100","66","2014  >  43352 [ACK] Seq=1 Ack=44823 Win=1396 Len=0 TSval=2668792679 TSecr=3395050446"
"896","49.395809149","192.168.101.100","192.168.101.200","1612","43352  >  2014 [PSH, ACK] Seq=44823 Ack=1 Win=501 Len=1546 TSval=3395051387 TSecr=2668792679"
"898","49.396241434","192.168.101.200","192.168.101.100","66","2014  >  43352 [ACK] Seq=1 Ack=46369 Win=1388 Len=0 TSval=2668793620 TSecr=3395051387"
"914","50.403414743","192.168.101.100","192.168.101.200","1514","43352  >  2014 [ACK] Seq=46369 Ack=1 Win=501 Len=1448 TSval=3395052395 TSecr=2668793620"
"915","50.403463492","192.168.101.100","192.168.101.200","164","43352  >  2014 [PSH, ACK] Seq=47817 Ack=1 Win=501 Len=98 TSval=3395052395 TSecr=2668793620"
"917","50.403890301","192.168.101.200","192.168.101.100","66","2014  >  43352 [ACK] Seq=1 Ack=47817 Win=1391 Len=0 TSval=2668794628 TSecr=3395052395"
"918","50.478065596","192.168.101.100","192.168.101.200","164","[TCP Retransmission] 43352  >  2014 [PSH, ACK] Seq=47817 Ack=1 Win=501 Len=98 TSval=3395052470 TSecr=2668793620"
"923","50.491671900","192.168.101.200","192.168.101.100","66","2014  >  43352 [ACK] Seq=1 Ack=47915 Win=1396 Len=0 TSval=2668794716 TSecr=3395052470"
"938","51.410236635","192.168.101.100","192.168.101.200","1514","43352  >  2014 [ACK] Seq=47915 Ack=1 Win=501 Len=1448 TSval=3395053402 TSecr=2668794716"
"939","51.410319944","192.168.101.100","192.168.101.200","164","43352  >  2014 [PSH, ACK] Seq=49363 Ack=1 Win=501 Len=98 TSval=3395053402 TSecr=2668794716"
"942","51.410769867","192.168.101.200","192.168.101.100","66","2014  >  43352 [ACK] Seq=1 Ack=49461 Win=1388 Len=0 TSval=2668795635 TSecr=3395053402"
"959","52.418022972","192.168.101.100","192.168.101.200","1514","43352  >  2014 [ACK] Seq=49461 Ack=1 Win=501 Len=1448 TSval=3395054410 TSecr=2668795635"
"960","52.418093835","192.168.101.100","192.168.101.200","160","43352  >  2014 [PSH, ACK] Seq=50909 Ack=1 Win=501 Len=94 TSval=3395054410 TSecr=2668795635"
"963","52.418535572","192.168.101.200","192.168.101.100","66","2014  >  43352 [ACK] Seq=1 Ack=51003 Win=1388 Len=0 TSval=2668796643 TSecr=3395054410"
"979","53.425788854","192.168.101.100","192.168.101.200","1514","43352  >  2014 [ACK] Seq=51003 Ack=1 Win=501 Len=1448 TSval=3395055417 TSecr=2668796643"
"980","53.425829006","192.168.101.100","192.168.101.200","160","43352  >  2014 [PSH, ACK] Seq=52451 Ack=1 Win=501 Len=94 TSval=3395055417 TSecr=2668796643"
"982","53.426194399","192.168.101.200","192.168.101.100","66","2014  >  43352 [ACK] Seq=1 Ack=52451 Win=1391 Len=0 TSval=2668797650 TSecr=3395055417"
"993","53.745546171","192.168.101.100","192.168.101.200","160","[TCP Retransmission] 43352  >  2014 [PSH, ACK] Seq=52451 Ack=1 Win=501 Len=94 TSval=3395055737 TSecr=2668797650"
"995","53.746088793","192.168.101.200","192.168.101.100","66","2014  >  43352 [ACK] Seq=1 Ack=52545 Win=1396 Len=0 TSval=2668797970 TSecr=3395055737"
"1000","54.433339927","192.168.101.100","192.168.101.200","1514","43352  >  2014 [ACK] Seq=52545 Ack=1 Win=501 Len=1448 TSval=3395056425 TSecr=2668797970"
"1001","54.433408959","192.168.101.100","192.168.101.200","164","43352  >  2014 [PSH, ACK] Seq=53993 Ack=1 Win=501 Len=98 TSval=3395056425 TSecr=2668797970"
"1003","54.433867576","192.168.101.200","192.168.101.100","66","2014  >  43352 [ACK] Seq=1 Ack=54091 Win=1388 Len=0 TSval=2668798658 TSecr=3395056425"
"1010","54.681427000","192.168.101.100","192.168.101.200","1514","[TCP Spurious Retransmission] 43352  >  2014 [ACK] Seq=52545 Ack=1 Win=501 Len=1448 TSval=3395056673 TSecr=2668797970"
"1012","54.681866010","192.168.101.200","192.168.101.100","78","[TCP Window Update] 2014  >  43352 [ACK] Seq=1 Ack=54091 Win=1399 Len=0 TSval=2668798906 TSecr=3395056425 SLE=52545 SRE=53993"
"1021","55.441273004","192.168.101.100","192.168.101.200","1514","43352  >  2014 [ACK] Seq=54091 Ack=1 Win=501 Len=1448 TSval=3395057433 TSecr=2668798906"
"1022","55.441344291","192.168.101.100","192.168.101.200","164","43352  >  2014 [PSH, ACK] Seq=55539 Ack=1 Win=501 Len=98 TSval=3395057433 TSecr=2668798906"
"1025","55.441712943","192.168.101.200","192.168.101.100","66","2014  >  43352 [ACK] Seq=1 Ack=55637 Win=1388 Len=0 TSval=2668799666 TSecr=3395057433"
"1029","55.593255173","192.168.101.100","192.168.101.200","164","[TCP Spurious Retransmission] 43352  >  2014 [PSH, ACK] Seq=55539 Ack=1 Win=501 Len=98 TSval=3395057585 TSecr=2668798906"
"1031","55.593712237","192.168.101.200","192.168.101.100","78","[TCP Window Update] 2014  >  43352 [ACK] Seq=1 Ack=55637 Win=1399 Len=0 TSval=2668799818 TSecr=3395057585 SLE=55539 SRE=55637"
"1045","56.453192442","192.168.101.100","192.168.101.200","1514","43352  >  2014 [ACK] Seq=55637 Ack=1 Win=501 Len=1448 TSval=3395058445 TSecr=2668799818"
"1046","56.453259257","192.168.101.100","192.168.101.200","164","43352  >  2014 [PSH, ACK] Seq=57085 Ack=1 Win=501 Len=98 TSval=3395058445 TSecr=2668799818"
"1048","56.453692051","192.168.101.200","192.168.101.100","66","2014  >  43352 [ACK] Seq=1 Ack=57183 Win=1388 Len=0 TSval=2668800678 TSecr=3395058445"
"1053","56.589873871","192.168.101.100","192.168.101.200","164","[TCP Spurious Retransmission] 43352  >  2014 [PSH, ACK] Seq=57085 Ack=1 Win=501 Len=98 TSval=3395058581 TSecr=2668799818"
"1055","56.590505410","192.168.101.200","192.168.101.100","78","[TCP Window Update] 2014  >  43352 [ACK] Seq=1 Ack=57183 Win=1399 Len=0 TSval=2668800814 TSecr=3395058581 SLE=57085 SRE=57183"
"1069","57.460990633","192.168.101.100","192.168.101.200","1514","43352  >  2014 [ACK] Seq=57183 Ack=1 Win=501 Len=1448 TSval=3395059452 TSecr=2668800814"
"1070","57.461065661","192.168.101.100","192.168.101.200","164","43352  >  2014 [PSH, ACK] Seq=58631 Ack=1 Win=501 Len=98 TSval=3395059452 TSecr=2668800814"
"1072","57.461456115","192.168.101.200","192.168.101.100","78","[TCP Dup ACK 1048#2] 2014  >  43352 [ACK] Seq=1 Ack=57183 Win=1399 Len=0 TSval=2668801685 TSecr=3395058581 SLE=58631 SRE=58729"
"1074","57.561920857","192.168.101.100","192.168.101.200","1514","[TCP Retransmission] 43352  >  2014 [ACK] Seq=57183 Ack=1 Win=501 Len=1448 TSval=3395059553 TSecr=2668801685"
"1076","57.562496667","192.168.101.200","192.168.101.100","66","2014  >  43352 [ACK] Seq=1 Ack=58729 Win=1388 Len=0 TSval=2668801786 TSecr=3395059553"
"1088","57.942138884","192.168.101.100","192.168.101.200","1514","[TCP Spurious Retransmission] 43352  >  2014 [ACK] Seq=57183 Ack=1 Win=501 Len=1448 TSval=3395059934 TSecr=2668801685"
"1090","57.942798660","192.168.101.200","192.168.101.100","78","[TCP Window Update] 2014  >  43352 [ACK] Seq=1 Ack=58729 Win=1399 Len=0 TSval=2668802167 TSecr=3395059553 SLE=57183 SRE=58631"
"1093","58.468376616","192.168.101.100","192.168.101.200","1514","43352  >  2014 [ACK] Seq=58729 Ack=1 Win=501 Len=1448 TSval=3395060460 TSecr=2668802167"
"1094","58.468437316","192.168.101.100","192.168.101.200","164","43352  >  2014 [PSH, ACK] Seq=60177 Ack=1 Win=501 Len=98 TSval=3395060460 TSecr=2668802167"
"1099","58.665595291","192.168.101.100","192.168.101.200","164","[TCP Retransmission] 43352  >  2014 [PSH, ACK] Seq=60177 Ack=1 Win=501 Len=98 TSval=3395060657 TSecr=2668802167"
"1101","58.666065562","192.168.101.200","192.168.101.100","78","[TCP Dup ACK 1076#2] 2014  >  43352 [ACK] Seq=1 Ack=58729 Win=1399 Len=0 TSval=2668802890 TSecr=3395059553 SLE=60177 SRE=60275"
"1112","59.285825127","192.168.101.100","192.168.101.200","1514","[TCP Retransmission] 43352  >  2014 [ACK] Seq=58729 Ack=1 Win=501 Len=1448 TSval=3395061277 TSecr=2668802890"
"1114","59.286440732","192.168.101.200","192.168.101.100","66","2014  >  43352 [ACK] Seq=1 Ack=60275 Win=1388 Len=0 TSval=2668803510 TSecr=3395061277"
"1116","59.476301167","192.168.101.100","192.168.101.200","1514","43352  >  2014 [ACK] Seq=60275 Ack=1 Win=501 Len=1448 TSval=3395061468 TSecr=2668803510"
"1117","59.476351793","192.168.101.100","192.168.101.200","164","43352  >  2014 [PSH, ACK] Seq=61723 Ack=1 Win=501 Len=98 TSval=3395061468 TSecr=2668803510"
"1119","59.476746445","192.168.101.200","192.168.101.100","66","2014  >  43352 [ACK] Seq=1 Ack=61821 Win=1388 Len=0 TSval=2668803701 TSecr=3395061468"
"1124","59.654253603","192.168.101.100","192.168.101.200","164","[TCP Spurious Retransmission] 43352  >  2014 [PSH, ACK] Seq=61723 Ack=1 Win=501 Len=98 TSval=3395061646 TSecr=2668803510"
"1126","59.655348099","192.168.101.200","192.168.101.100","78","[TCP Window Update] 2014  >  43352 [ACK] Seq=1 Ack=61821 Win=1399 Len=0 TSval=2668803879 TSecr=3395061646 SLE=61723 SRE=61821"
"1138","60.245618656","192.168.101.100","192.168.101.200","1514","[TCP Spurious Retransmission] 43352  >  2014 [ACK] Seq=60275 Ack=1 Win=501 Len=1448 TSval=3395062237 TSecr=2668803510"
"1140","60.246288206","192.168.101.200","192.168.101.100","78","[TCP Dup ACK 1119#1] 2014  >  43352 [ACK] Seq=1 Ack=61821 Win=1399 Len=0 TSval=2668804470 TSecr=3395061646 SLE=60275 SRE=61723"
"1142","60.501750116","192.168.101.100","192.168.101.200","1514","43352  >  2014 [ACK] Seq=61821 Ack=1 Win=501 Len=1448 TSval=3395062493 TSecr=2668804470"
"1143","60.501848229","192.168.101.100","192.168.101.200","164","43352  >  2014 [PSH, ACK] Seq=63269 Ack=1 Win=501 Len=98 TSval=3395062493 TSecr=2668804470"
"1146","60.502272096","192.168.101.200","192.168.101.100","66","2014  >  43352 [ACK] Seq=1 Ack=63367 Win=1388 Len=0 TSval=2668804726 TSecr=3395062493"
"1162","61.509896516","192.168.101.100","192.168.101.200","1612","43352  >  2014 [PSH, ACK] Seq=63367 Ack=1 Win=501 Len=1546 TSval=3395063501 TSecr=2668804726"
"1164","61.510392863","192.168.101.200","192.168.101.100","66","2014  >  43352 [ACK] Seq=1 Ack=64913 Win=1388 Len=0 TSval=2668805734 TSecr=3395063501"
"1169","61.782088081","192.168.101.100","192.168.101.200","164","[TCP Spurious Retransmission] 43352  >  2014 [PSH, ACK] Seq=64815 Ack=1 Win=501 Len=98 TSval=3395063773 TSecr=2668804726"
"1171","61.782756465","192.168.101.200","192.168.101.100","78","[TCP Window Update] 2014  >  43352 [ACK] Seq=1 Ack=64913 Win=1399 Len=0 TSval=2668806006 TSecr=3395063773 SLE=64815 SRE=64913"
"1179","62.516473353","192.168.101.100","192.168.101.200","1612","43352  >  2014 [PSH, ACK] Seq=64913 Ack=1 Win=501 Len=1546 TSval=3395064508 TSecr=2668806006"
"1181","62.517057746","192.168.101.200","192.168.101.100","66","2014  >  43352 [ACK] Seq=1 Ack=66459 Win=1388 Len=0 TSval=2668806741 TSecr=3395064508"
"1185","62.753423752","192.168.101.100","192.168.101.200","164","[TCP Spurious Retransmission] 43352  >  2014 [PSH, ACK] Seq=66361 Ack=1 Win=501 Len=98 TSval=3395064745 TSecr=2668806006"
"1187","62.754158419","192.168.101.200","192.168.101.100","78","[TCP Window Update] 2014  >  43352 [ACK] Seq=1 Ack=66459 Win=1399 Len=0 TSval=2668806978 TSecr=3395064745 SLE=66361 SRE=66459"
"1201","63.524477527","192.168.101.100","192.168.101.200","1612","43352  >  2014 [PSH, ACK] Seq=66459 Ack=1 Win=501 Len=1546 TSval=3395065516 TSecr=2668806978"
"1203","63.524958960","192.168.101.200","192.168.101.100","66","2014  >  43352 [ACK] Seq=1 Ack=68005 Win=1388 Len=0 TSval=2668807749 TSecr=3395065516"
"1220","64.533613798","192.168.101.100","192.168.101.200","1612","43352  >  2014 [PSH, ACK] Seq=68005 Ack=1 Win=501 Len=1546 TSval=3395066525 TSecr=2668807749"
"1225","64.741516445","192.168.101.100","192.168.101.200","164","[TCP Retransmission] 43352  >  2014 [PSH, ACK] Seq=69453 Ack=1 Win=501 Len=98 TSval=3395066733 TSecr=2668807749"
"1227","64.741941963","192.168.101.200","192.168.101.100","78","[TCP Window Update] 2014  >  43352 [ACK] Seq=1 Ack=68005 Win=1396 Len=0 TSval=2668808966 TSecr=3395065516 SLE=69453 SRE=69551"
"1241","65.540795825","192.168.101.100","192.168.101.200","1612","43352  >  2014 [PSH, ACK] Seq=69551 Ack=1 Win=501 Len=1546 TSval=3395067532 TSecr=2668808966"
"1243","65.541295487","192.168.101.200","192.168.101.100","78","[TCP Dup ACK 1203#3] 2014  >  43352 [ACK] Seq=1 Ack=68005 Win=1396 Len=0 TSval=2668809765 TSecr=3395065516 SLE=69453 SRE=71097"
"1244","65.557288756","192.168.101.100","192.168.101.200","1514","[TCP Fast Retransmission] 43352  >  2014 [ACK] Seq=68005 Ack=1 Win=501 Len=1448 TSval=3395067548 TSecr=2668808966"
"1246","65.607658193","192.168.101.200","192.168.101.100","66","2014  >  43352 [ACK] Seq=1 Ack=71097 Win=1379 Len=0 TSval=2668809831 TSecr=3395067548"
"1272","67.189989433","192.168.101.100","192.168.101.200","1514","[TCP Spurious Retransmission] 43352  >  2014 [ACK] Seq=68005 Ack=1 Win=501 Len=1448 TSval=3395069181 TSecr=2668808966"
"1274","67.190632188","192.168.101.200","192.168.101.100","78","[TCP Window Update] 2014  >  43352 [ACK] Seq=1 Ack=71097 Win=1399 Len=0 TSval=2668811414 TSecr=3395067548 SLE=68005 SRE=69453"
"1276","67.190909400","192.168.101.100","192.168.101.200","1612","43352  >  2014 [PSH, ACK] Seq=71097 Ack=1 Win=501 Len=1546 TSval=3395069182 TSecr=2668811414"
"1278","67.191381591","192.168.101.200","192.168.101.100","66","2014  >  43352 [ACK] Seq=1 Ack=72545 Win=1391 Len=0 TSval=2668811415 TSecr=3395069182"
"1280","67.286456700","192.168.101.200","192.168.101.100","66","2014  >  43352 [ACK] Seq=1 Ack=72643 Win=1396 Len=0 TSval=2668811510 TSecr=3395069182"
"1288","67.559205171","192.168.101.100","192.168.101.200","1612","43352  >  2014 [PSH, ACK] Seq=72643 Ack=1 Win=501 Len=1546 TSval=3395069550 TSecr=2668811510"
"1290","67.559670265","192.168.101.200","192.168.101.100","66","2014  >  43352 [ACK] Seq=1 Ack=74189 Win=1388 Len=0 TSval=2668811783 TSecr=3395069550"
"1305","68.085787334","192.168.101.100","192.168.101.200","164","[TCP Spurious Retransmission] 43352  >  2014 [PSH, ACK] Seq=74091 Ack=1 Win=501 Len=98 TSval=3395070077 TSecr=2668811510"
"1310","68.565837588","192.168.101.100","192.168.101.200","1612","43352  >  2014 [PSH, ACK] Seq=74189 Ack=1 Win=501 Len=1546 TSval=3395070557 TSecr=2668811510"
"1312","68.566307018","192.168.101.200","192.168.101.100","78","[TCP Window Update] 2014  >  43352 [ACK] Seq=1 Ack=74189 Win=1396 Len=0 TSval=2668812790 TSecr=3395069550 SLE=75637 SRE=75735"
"1327","69.574849913","192.168.101.100","192.168.101.200","1612","43352  >  2014 [PSH, ACK] Seq=75735 Ack=1 Win=501 Len=1546 TSval=3395071566 TSecr=2668812790"
"1329","69.575266518","192.168.101.200","192.168.101.100","86","[TCP Dup ACK 1290#2] 2014  >  43352 [ACK] Seq=1 Ack=74189 Win=1396 Len=0 TSval=2668813799 TSecr=3395069550 SLE=77183 SRE=77281 SLE=75637 SRE=75735"
"1331","69.620574836","192.168.101.100","192.168.101.200","1514","[TCP Fast Retransmission] 43352  >  2014 [ACK] Seq=74189 Ack=1 Win=501 Len=1448 TSval=3395071612 TSecr=2668813799"
"1333","69.621130733","192.168.101.200","192.168.101.100","78","2014  >  43352 [ACK] Seq=1 Ack=75735 Win=1385 Len=0 TSval=2668813845 TSecr=3395071612 SLE=77183 SRE=77281"
"1334","69.673965041","192.168.101.100","192.168.101.200","1514","[TCP Retransmission] 43352  >  2014 [ACK] Seq=75735 Ack=1 Win=501 Len=1448 TSval=3395071665 TSecr=2668813799"
"1337","69.705070565","192.168.101.200","192.168.101.100","66","2014  >  43352 [ACK] Seq=1 Ack=77281 Win=1388 Len=0 TSval=2668813928 TSecr=3395071665"
"1351","70.582171666","192.168.101.100","192.168.101.200","1514","43352  >  2014 [ACK] Seq=77281 Ack=1 Win=501 Len=1448 TSval=3395072573 TSecr=2668813928"
"1352","70.582255180","192.168.101.100","192.168.101.200","160","43352  >  2014 [PSH, ACK] Seq=78729 Ack=1 Win=501 Len=94 TSval=3395072573 TSecr=2668813928"
"1354","70.582588860","192.168.101.200","192.168.101.100","66","2014  >  43352 [ACK] Seq=1 Ack=78823 Win=1388 Len=0 TSval=2668814806 TSecr=3395072573"
"1371","71.589381309","192.168.101.100","192.168.101.200","1514","43352  >  2014 [ACK] Seq=78823 Ack=1 Win=501 Len=1448 TSval=3395073580 TSecr=2668814806"
"1372","71.589449103","192.168.101.100","192.168.101.200","164","43352  >  2014 [PSH, ACK] Seq=80271 Ack=1 Win=501 Len=98 TSval=3395073580 TSecr=2668814806"
"1374","71.589874367","192.168.101.200","192.168.101.100","66","2014  >  43352 [ACK] Seq=1 Ack=80271 Win=1391 Len=0 TSval=2668815813 TSecr=3395073580"
"1379","71.925996322","192.168.101.100","192.168.101.200","164","[TCP Retransmission] 43352  >  2014 [PSH, ACK] Seq=80271 Ack=1 Win=501 Len=98 TSval=3395073917 TSecr=2668814806"
"1381","71.927853282","192.168.101.200","192.168.101.100","66","2014  >  43352 [ACK] Seq=1 Ack=80369 Win=1396 Len=0 TSval=2668816150 TSecr=3395073917"
"1394","72.597187767","192.168.101.100","192.168.101.200","1514","43352  >  2014 [ACK] Seq=80369 Ack=1 Win=501 Len=1448 TSval=3395074588 TSecr=2668816150"
"1395","72.597270902","192.168.101.100","192.168.101.200","164","43352  >  2014 [PSH, ACK] Seq=81817 Ack=1 Win=501 Len=98 TSval=3395074588 TSecr=2668816150"
"1397","72.597644604","192.168.101.200","192.168.101.100","66","2014  >  43352 [ACK] Seq=1 Ack=81817 Win=1391 Len=0 TSval=2668816821 TSecr=3395074588"
"1405","73.077982318","192.168.101.100","192.168.101.200","164","[TCP Retransmission] 43352  >  2014 [PSH, ACK] Seq=81817 Ack=1 Win=501 Len=98 TSval=3395075069 TSecr=2668816821"
"1409","73.078644668","192.168.101.200","192.168.101.100","66","2014  >  43352 [ACK] Seq=1 Ack=81915 Win=1396 Len=0 TSval=2668817302 TSecr=3395075069"
"1418","73.615403966","192.168.101.100","192.168.101.200","1514","43352  >  2014 [ACK] Seq=81915 Ack=1 Win=501 Len=1448 TSval=3395075606 TSecr=2668817302"
"1419","73.615445059","192.168.101.100","192.168.101.200","164","43352  >  2014 [PSH, ACK] Seq=83363 Ack=1 Win=501 Len=98 TSval=3395075606 TSecr=2668817302"
"1421","73.615833803","192.168.101.200","192.168.101.100","66","2014  >  43352 [ACK] Seq=1 Ack=83461 Win=1388 Len=0 TSval=2668817839 TSecr=3395075606"
"1438","74.624264622","192.168.101.100","192.168.101.200","1514","43352  >  2014 [ACK] Seq=83461 Ack=1 Win=501 Len=1448 TSval=3395076615 TSecr=2668817839"
"1439","74.624316673","192.168.101.100","192.168.101.200","164","43352  >  2014 [PSH, ACK] Seq=84909 Ack=1 Win=501 Len=98 TSval=3395076615 TSecr=2668817839"
"1441","74.624748925","192.168.101.200","192.168.101.100","78","[TCP Window Update] 2014  >  43352 [ACK] Seq=1 Ack=83461 Win=1396 Len=0 TSval=2668818848 TSecr=3395075606 SLE=84909 SRE=85007"
"1443","74.777619073","192.168.101.100","192.168.101.200","1514","[TCP Retransmission] 43352  >  2014 [ACK] Seq=83461 Ack=1 Win=501 Len=1448 TSval=3395076769 TSecr=2668818848"
"1445","74.778153709","192.168.101.200","192.168.101.100","66","2014  >  43352 [ACK] Seq=1 Ack=85007 Win=1388 Len=0 TSval=2668819002 TSecr=3395076769"
"1455","75.861915883","192.168.101.100","192.168.101.200","1514","[TCP Spurious Retransmission] 43352  >  2014 [ACK] Seq=83461 Ack=1 Win=501 Len=1448 TSval=3395077853 TSecr=2668818848"
"1457","75.862625605","192.168.101.200","192.168.101.100","78","[TCP Window Update] 2014  >  43352 [ACK] Seq=1 Ack=85007 Win=1399 Len=0 TSval=2668820086 TSecr=3395076769 SLE=83461 SRE=84909"
"1459","75.862796873","192.168.101.100","192.168.101.200","1514","43352  >  2014 [ACK] Seq=85007 Ack=1 Win=501 Len=1448 TSval=3395077854 TSecr=2668820086"
"1460","75.862839469","192.168.101.100","192.168.101.200","164","43352  >  2014 [PSH, ACK] Seq=86455 Ack=1 Win=501 Len=98 TSval=3395077854 TSecr=2668820086"
"1463","75.914194230","192.168.101.200","192.168.101.100","78","[TCP Dup ACK 1445#2] 2014  >  43352 [ACK] Seq=1 Ack=85007 Win=1399 Len=0 TSval=2668820137 TSecr=3395076769 SLE=86455 SRE=86553"
"1468","76.065912286","192.168.101.100","192.168.101.200","1514","[TCP Retransmission] 43352  >  2014 [ACK] Seq=85007 Ack=1 Win=501 Len=1448 TSval=3395078057 TSecr=2668820137"
"1470","76.066831381","192.168.101.200","192.168.101.100","66","2014  >  43352 [ACK] Seq=1 Ack=86553 Win=1388 Len=0 TSval=2668820290 TSecr=3395078057"
"1484","76.640002461","192.168.101.100","192.168.101.200","1514","43352  >  2014 [ACK] Seq=86553 Ack=1 Win=501 Len=1448 TSval=3395078631 TSecr=2668820290"
"1485","76.640055066","192.168.101.100","192.168.101.200","164","43352  >  2014 [PSH, ACK] Seq=88001 Ack=1 Win=501 Len=98 TSval=3395078631 TSecr=2668820290"
"1488","76.640519969","192.168.101.200","192.168.101.100","66","2014  >  43352 [ACK] Seq=1 Ack=88099 Win=1388 Len=0 TSval=2668820864 TSecr=3395078631"
"1503","77.649837974","192.168.101.100","192.168.101.200","1514","43352  >  2014 [ACK] Seq=88099 Ack=1 Win=501 Len=1448 TSval=3395079641 TSecr=2668820864"
"1504","77.649984911","192.168.101.100","192.168.101.200","164","43352  >  2014 [PSH, ACK] Seq=89547 Ack=1 Win=501 Len=98 TSval=3395079641 TSecr=2668820864"
"1506","77.650297994","192.168.101.200","192.168.101.100","66","2014  >  43352 [ACK] Seq=1 Ack=89547 Win=1391 Len=0 TSval=2668821874 TSecr=3395079641"
"1510","78.037955392","192.168.101.100","192.168.101.200","164","[TCP Retransmission] 43352  >  2014 [PSH, ACK] Seq=89547 Ack=1 Win=501 Len=98 TSval=3395080029 TSecr=2668820864"
"1512","78.038593459","192.168.101.200","192.168.101.100","66","2014  >  43352 [ACK] Seq=1 Ack=89645 Win=1396 Len=0 TSval=2668822262 TSecr=3395080029"
"1525","78.665093463","192.168.101.100","192.168.101.200","1612","43352  >  2014 [PSH, ACK] Seq=89645 Ack=1 Win=501 Len=1546 TSval=3395080656 TSecr=2668822262"
"1527","78.665503665","192.168.101.200","192.168.101.100","78","[TCP Dup ACK 1512#2] 2014  >  43352 [ACK] Seq=1 Ack=89645 Win=1396 Len=0 TSval=2668822889 TSecr=3395080029 SLE=91093 SRE=91191"
"1529","78.769496902","192.168.101.100","192.168.101.200","1514","[TCP Retransmission] 43352  >  2014 [ACK] Seq=89645 Ack=1 Win=501 Len=1448 TSval=3395080760 TSecr=2668822889"
"1531","78.770123172","192.168.101.200","192.168.101.100","66","2014  >  43352 [ACK] Seq=1 Ack=91191 Win=1388 Len=0 TSval=2668822993 TSecr=3395080760"
"1546","79.677619457","192.168.101.100","192.168.101.200","1514","43352  >  2014 [ACK] Seq=91191 Ack=1 Win=501 Len=1448 TSval=3395081668 TSecr=2668822993"
"1547","79.677725886","192.168.101.100","192.168.101.200","164","43352  >  2014 [PSH, ACK] Seq=92639 Ack=1 Win=501 Len=98 TSval=3395081668 TSecr=2668822993"
"1549","79.678140662","192.168.101.200","192.168.101.100","66","2014  >  43352 [ACK] Seq=1 Ack=92737 Win=1388 Len=0 TSval=2668823901 TSecr=3395081668"
"1566","80.689435413","192.168.101.100","192.168.101.200","1514","43352  >  2014 [ACK] Seq=92737 Ack=1 Win=501 Len=1448 TSval=3395082680 TSecr=2668823901"
"1567","80.689525647","192.168.101.100","192.168.101.200","164","43352  >  2014 [PSH, ACK] Seq=94185 Ack=1 Win=501 Len=98 TSval=3395082680 TSecr=2668823901"
"1569","80.690093454","192.168.101.200","192.168.101.100","66","2014  >  43352 [ACK] Seq=1 Ack=94185 Win=1391 Len=0 TSval=2668824913 TSecr=3395082680"
"1572","80.714989009","192.168.101.200","192.168.101.100","66","2014  >  43352 [ACK] Seq=1 Ack=94283 Win=1396 Len=0 TSval=2668824938 TSecr=3395082680"
"1577","81.142054047","192.168.101.100","192.168.101.200","164","[TCP Spurious Retransmission] 43352  >  2014 [PSH, ACK] Seq=94185 Ack=1 Win=501 Len=98 TSval=3395083133 TSecr=2668824913"
"1579","81.142618206","192.168.101.200","192.168.101.100","78","[TCP Window Update] 2014  >  43352 [ACK] Seq=1 Ack=94283 Win=1399 Len=0 TSval=2668825366 TSecr=3395083133 SLE=94185 SRE=94283"
"1590","81.699019071","192.168.101.100","192.168.101.200","1608","43352  >  2014 [PSH, ACK] Seq=94283 Ack=1 Win=501 Len=1542 TSval=3395083690 TSecr=2668825366"
"1592","81.699593164","192.168.101.200","192.168.101.100","66","2014  >  43352 [ACK] Seq=1 Ack=95731 Win=1391 Len=0 TSval=2668825923 TSecr=3395083690"
"1594","81.717316612","192.168.101.200","192.168.101.100","66","2014  >  43352 [ACK] Seq=1 Ack=95825 Win=1396 Len=0 TSval=2668825941 TSecr=3395083690"
"1612","82.713751534","192.168.101.100","192.168.101.200","1612","43352  >  2014 [PSH, ACK] Seq=95825 Ack=1 Win=501 Len=1546 TSval=3395084704 TSecr=2668825941"
"1614","82.714365801","192.168.101.200","192.168.101.100","66","2014  >  43352 [ACK] Seq=1 Ack=97273 Win=1391 Len=0 TSval=2668826937 TSecr=3395084704"
"1616","82.718607385","192.168.101.200","192.168.101.100","66","2014  >  43352 [ACK] Seq=1 Ack=97371 Win=1396 Len=0 TSval=2668826942 TSecr=3395084704"
"1631","83.717236520","192.168.101.100","192.168.101.200","1612","43352  >  2014 [PSH, ACK] Seq=97371 Ack=1 Win=501 Len=1546 TSval=3395085708 TSecr=2668826942"
"1633","83.717699940","192.168.101.200","192.168.101.100","66","2014  >  43352 [ACK] Seq=1 Ack=98917 Win=1388 Len=0 TSval=2668827941 TSecr=3395085708"
"1647","84.726547830","192.168.101.100","192.168.101.200","1612","43352  >  2014 [PSH, ACK] Seq=98917 Ack=1 Win=501 Len=1546 TSval=3395086717 TSecr=2668827941"
"1649","84.726995803","192.168.101.200","192.168.101.100","66","2014  >  43352 [ACK] Seq=1 Ack=100463 Win=1388 Len=0 TSval=2668828950 TSecr=3395086717"
"1659","85.741714640","192.168.101.100","192.168.101.200","1612","43352  >  2014 [PSH, ACK] Seq=100463 Ack=1 Win=501 Len=1546 TSval=3395087732 TSecr=2668828950"
"1661","85.742159354","192.168.101.200","192.168.101.100","66","2014  >  43352 [ACK] Seq=1 Ack=102009 Win=1388 Len=0 TSval=2668829965 TSecr=3395087732"
"1679","86.745126974","192.168.101.100","192.168.101.200","1612","43352  >  2014 [PSH, ACK] Seq=102009 Ack=1 Win=501 Len=1546 TSval=3395088736 TSecr=2668829965"
"1681","86.745582486","192.168.101.200","192.168.101.100","66","2014  >  43352 [ACK] Seq=1 Ack=103457 Win=1391 Len=0 TSval=2668830969 TSecr=3395088736"
"1684","86.821064279","192.168.101.200","192.168.101.100","66","2014  >  43352 [ACK] Seq=1 Ack=103555 Win=1396 Len=0 TSval=2668831044 TSecr=3395088736"
"1695","87.752011755","192.168.101.100","192.168.101.200","1612","43352  >  2014 [PSH, ACK] Seq=103555 Ack=1 Win=501 Len=1546 TSval=3395089743 TSecr=2668831044"
"1697","87.752451240","192.168.101.200","192.168.101.100","78","[TCP Dup ACK 1684#2] 2014  >  43352 [ACK] Seq=1 Ack=103555 Win=1396 Len=0 TSval=2668831975 TSecr=3395088736 SLE=105003 SRE=105101"
"1700","87.873668537","192.168.101.100","192.168.101.200","1514","[TCP Retransmission] 43352  >  2014 [ACK] Seq=103555 Ack=1 Win=501 Len=1448 TSval=3395089864 TSecr=2668831975"
"1705","88.341246721","192.168.101.100","192.168.101.200","1514","[TCP Retransmission] 43352  >  2014 [ACK] Seq=103555 Ack=1 Win=501 Len=1448 TSval=3395090332 TSecr=2668831975"
"1722","89.237607074","192.168.101.100","192.168.101.200","1514","[TCP Retransmission] 43352  >  2014 [ACK] Seq=103555 Ack=1 Win=501 Len=1448 TSval=3395091228 TSecr=2668831975"
"1724","89.238176258","192.168.101.200","192.168.101.100","66","2014  >  43352 [ACK] Seq=1 Ack=105101 Win=1388 Len=0 TSval=2668833461 TSecr=3395091228"
"1726","89.238487796","192.168.101.100","192.168.101.200","1514","43352  >  2014 [ACK] Seq=105101 Ack=1 Win=501 Len=1448 TSval=3395091229 TSecr=2668833461"
"1727","89.238530234","192.168.101.100","192.168.101.200","164","43352  >  2014 [PSH, ACK] Seq=106549 Ack=1 Win=501 Len=98 TSval=3395091229 TSecr=2668833461"
"1729","89.238877136","192.168.101.200","192.168.101.100","66","2014  >  43352 [ACK] Seq=1 Ack=106549 Win=1391 Len=0 TSval=2668833462 TSecr=3395091229"
"1731","89.333085105","192.168.101.200","192.168.101.100","66","2014  >  43352 [ACK] Seq=1 Ack=106647 Win=1396 Len=0 TSval=2668833556 TSecr=3395091229"
"1732","89.389625421","192.168.101.100","192.168.101.200","164","[TCP Spurious Retransmission] 43352  >  2014 [PSH, ACK] Seq=106549 Ack=1 Win=501 Len=98 TSval=3395091380 TSecr=2668833461"
"1735","89.414902916","192.168.101.200","192.168.101.100","78","[TCP Window Update] 2014  >  43352 [ACK] Seq=1 Ack=106647 Win=1399 Len=0 TSval=2668833638 TSecr=3395091380 SLE=106549 SRE=106647"
"1743","89.768711449","192.168.101.100","192.168.101.200","1514","43352  >  2014 [ACK] Seq=106647 Ack=1 Win=501 Len=1448 TSval=3395091759 TSecr=2668833556"
"1744","89.768834232","192.168.101.100","192.168.101.200","164","43352  >  2014 [PSH, ACK] Seq=108095 Ack=1 Win=501 Len=98 TSval=3395091759 TSecr=2668833556"
"1746","89.769225798","192.168.101.200","192.168.101.100","66","2014  >  43352 [ACK] Seq=1 Ack=108193 Win=1388 Len=0 TSval=2668833992 TSecr=3395091759"
"1763","90.776522808","192.168.101.100","192.168.101.200","1514","43352  >  2014 [ACK] Seq=108193 Ack=1 Win=501 Len=1448 TSval=3395092767 TSecr=2668833992"
"1764","90.776560929","192.168.101.100","192.168.101.200","164","43352  >  2014 [PSH, ACK] Seq=109641 Ack=1 Win=501 Len=98 TSval=3395092767 TSecr=2668833992"
"1766","90.776992165","192.168.101.200","192.168.101.100","66","2014  >  43352 [ACK] Seq=1 Ack=109739 Win=1388 Len=0 TSval=2668835000 TSecr=3395092767"
"1783","91.785105811","192.168.101.100","192.168.101.200","1612","43352  >  2014 [PSH, ACK] Seq=109739 Ack=1 Win=501 Len=1546 TSval=3395093775 TSecr=2668835000"
"1785","91.785788163","192.168.101.200","192.168.101.100","66","2014  >  43352 [ACK] Seq=1 Ack=111285 Win=1388 Len=0 TSval=2668836009 TSecr=3395093775"
"1800","92.791541338","192.168.101.100","192.168.101.200","1612","43352  >  2014 [PSH, ACK] Seq=111285 Ack=1 Win=501 Len=1546 TSval=3395094782 TSecr=2668836009"
"1802","92.792002613","192.168.101.200","192.168.101.100","66","2014  >  43352 [ACK] Seq=1 Ack=112831 Win=1388 Len=0 TSval=2668837015 TSecr=3395094782"
"1814","93.798993915","192.168.101.100","192.168.101.200","1612","43352  >  2014 [PSH, ACK] Seq=112831 Ack=1 Win=501 Len=1546 TSval=3395095789 TSecr=2668837015"
"1816","93.799494015","192.168.101.200","192.168.101.100","66","2014  >  43352 [ACK] Seq=1 Ack=114377 Win=1388 Len=0 TSval=2668838022 TSecr=3395095789"
"1832","94.806835443","192.168.101.100","192.168.101.200","1612","43352  >  2014 [PSH, ACK] Seq=114377 Ack=1 Win=501 Len=1546 TSval=3395096797 TSecr=2668838022"
"1834","94.807299293","192.168.101.200","192.168.101.100","66","2014  >  43352 [ACK] Seq=1 Ack=115923 Win=1388 Len=0 TSval=2668839030 TSecr=3395096797"
"1836","94.938320545","192.168.101.100","192.168.101.200","164","[TCP Spurious Retransmission] 43352  >  2014 [PSH, ACK] Seq=115825 Ack=1 Win=501 Len=98 TSval=3395096929 TSecr=2668838022"
"1837","95.253451300","192.168.101.100","192.168.101.200","1514","[TCP Spurious Retransmission] 43352  >  2014 [ACK] Seq=114377 Ack=1 Win=501 Len=1448 TSval=3395097244 TSecr=2668838022"
"1849","95.829263114","192.168.101.100","192.168.101.200","1514","[TCP Spurious Retransmission] 43352  >  2014 [ACK] Seq=114377 Ack=1 Win=501 Len=1448 TSval=3395097820 TSecr=2668838022"
"1850","95.832386515","192.168.101.200","192.168.101.100","78","[TCP Window Update] 2014  >  43352 [ACK] Seq=1 Ack=115923 Win=1399 Len=0 TSval=2668840053 TSecr=3395096797 SLE=114377 SRE=115825"
"1852","95.832409437","192.168.101.100","192.168.101.200","1612","43352  >  2014 [PSH, ACK] Seq=115923 Ack=1 Win=501 Len=1546 TSval=3395097823 TSecr=2668840053"
"1855","95.832808043","192.168.101.200","192.168.101.100","66","2014  >  43352 [ACK] Seq=1 Ack=117371 Win=1391 Len=0 TSval=2668840056 TSecr=3395097823"
"1857","95.927718118","192.168.101.200","192.168.101.100","66","2014  >  43352 [ACK] Seq=1 Ack=117469 Win=1396 Len=0 TSval=2668840150 TSecr=3395097823"
"1874","96.822523511","192.168.101.100","192.168.101.200","1612","43352  >  2014 [PSH, ACK] Seq=117469 Ack=1 Win=501 Len=1546 TSval=3395098813 TSecr=2668840150"
"1876","96.822928448","192.168.101.200","192.168.101.100","66","2014  >  43352 [ACK] Seq=1 Ack=119015 Win=1388 Len=0 TSval=2668841046 TSecr=3395098813"
"1893","97.829482687","192.168.101.100","192.168.101.200","1612","43352  >  2014 [PSH, ACK] Seq=119015 Ack=1 Win=501 Len=1546 TSval=3395099820 TSecr=2668841046"
"1895","97.829893416","192.168.101.200","192.168.101.100","78","[TCP Window Update] 2014  >  43352 [ACK] Seq=1 Ack=119015 Win=1396 Len=0 TSval=2668842053 TSecr=3395098813 SLE=120463 SRE=120561"
"1897","97.877227531","192.168.101.100","192.168.101.200","1514","[TCP Retransmission] 43352  >  2014 [ACK] Seq=119015 Ack=1 Win=501 Len=1448 TSval=3395099867 TSecr=2668842053"
"1913","98.966184317","192.168.101.100","192.168.101.200","1514","[TCP Retransmission] 43352  >  2014 [ACK] Seq=119015 Ack=1 Win=501 Len=1448 TSval=3395100956 TSecr=2668842053"
"1940","101.206321469","192.168.101.100","192.168.101.200","1514","[TCP Retransmission] 43352  >  2014 [ACK] Seq=119015 Ack=1 Win=501 Len=1448 TSval=3395103196 TSecr=2668842053"
"1942","101.206988449","192.168.101.200","192.168.101.100","66","2014  >  43352 [ACK] Seq=1 Ack=120561 Win=1388 Len=0 TSval=2668845429 TSecr=3395103196"
"1944","101.207215793","192.168.101.100","192.168.101.200","1514","43352  >  2014 [ACK] Seq=120561 Ack=1 Win=501 Len=1448 TSval=3395103197 TSecr=2668845429"
"1945","101.207259806","192.168.101.100","192.168.101.200","1514","43352  >  2014 [ACK] Seq=122009 Ack=1 Win=501 Len=1448 TSval=3395103197 TSecr=2668845429"
"1947","101.243803549","192.168.101.200","192.168.101.100","78","[TCP Window Update] 2014  >  43352 [ACK] Seq=1 Ack=120561 Win=1391 Len=0 TSval=2668845466 TSecr=3395103196 SLE=122009 SRE=123457"
"1950","101.343649032","192.168.101.100","192.168.101.200","1514","43352  >  2014 [ACK] Seq=123457 Ack=1 Win=501 Len=1448 TSval=3395103334 TSecr=2668845466"
"1954","101.344137170","192.168.101.200","192.168.101.100","78","[TCP Dup ACK 1942#3] 2014  >  43352 [ACK] Seq=1 Ack=120561 Win=1391 Len=0 TSval=2668845567 TSecr=3395103196 SLE=122009 SRE=124905"
"1955","101.390054117","192.168.101.100","192.168.101.200","1514","[TCP Retransmission] 43352  >  2014 [ACK] Seq=120561 Ack=1 Win=501 Len=1448 TSval=3395103380 TSecr=2668845466"
"1958","101.533479990","192.168.101.200","192.168.101.100","66","2014  >  43352 [ACK] Seq=1 Ack=124905 Win=1376 Len=0 TSval=2668845756 TSecr=3395103380"
"1960","101.533696981","192.168.101.100","192.168.101.200","356","43352  >  2014 [PSH, ACK] Seq=124905 Ack=1 Win=501 Len=290 TSval=3395103524 TSecr=2668845756"
"1962","101.534096481","192.168.101.200","192.168.101.100","66","2014  >  43352 [ACK] Seq=1 Ack=125195 Win=1391 Len=0 TSval=2668845757 TSecr=3395103524"
"1969","101.862305017","192.168.101.100","192.168.101.200","1514","43352  >  2014 [ACK] Seq=125195 Ack=1 Win=501 Len=1448 TSval=3395103852 TSecr=2668845757"
"1970","101.862366229","192.168.101.100","192.168.101.200","160","43352  >  2014 [PSH, ACK] Seq=126643 Ack=1 Win=501 Len=94 TSval=3395103852 TSecr=2668845757"
"1972","101.864947253","192.168.101.200","192.168.101.100","78","[TCP Window Update] 2014  >  43352 [ACK] Seq=1 Ack=125195 Win=1396 Len=0 TSval=2668846087 TSecr=3395103524 SLE=126643 SRE=126737"
"1974","101.981179570","192.168.101.100","192.168.101.200","1514","[TCP Retransmission] 43352  >  2014 [ACK] Seq=125195 Ack=1 Win=501 Len=1448 TSval=3395103971 TSecr=2668846087"
"1976","101.981717555","192.168.101.200","192.168.101.100","66","2014  >  43352 [ACK] Seq=1 Ack=126737 Win=1388 Len=0 TSval=2668846204 TSecr=3395103971"
"1994","102.867609698","192.168.101.100","192.168.101.200","1514","43352  >  2014 [ACK] Seq=126737 Ack=1 Win=501 Len=1448 TSval=3395104858 TSecr=2668846204"
"1995","102.867702079","192.168.101.100","192.168.101.200","164","43352  >  2014 [PSH, ACK] Seq=128185 Ack=1 Win=501 Len=98 TSval=3395104858 TSecr=2668846204"
"1997","102.868129205","192.168.101.200","192.168.101.100","66","2014  >  43352 [ACK] Seq=1 Ack=128283 Win=1388 Len=0 TSval=2668847091 TSecr=3395104858"
"2008","103.876373452","192.168.101.100","192.168.101.200","1514","43352  >  2014 [ACK] Seq=128283 Ack=1 Win=501 Len=1448 TSval=3395105866 TSecr=2668847091"
"2009","103.876415251","192.168.101.100","192.168.101.200","164","43352  >  2014 [PSH, ACK] Seq=129731 Ack=1 Win=501 Len=98 TSval=3395105866 TSecr=2668847091"
"2011","103.876783661","192.168.101.200","192.168.101.100","66","2014  >  43352 [ACK] Seq=1 Ack=129829 Win=1388 Len=0 TSval=2668848099 TSecr=3395105866"
"2025","104.883841985","192.168.101.100","192.168.101.200","1612","43352  >  2014 [PSH, ACK] Seq=129829 Ack=1 Win=501 Len=1546 TSval=3395106874 TSecr=2668848099"
"2027","104.884347934","192.168.101.200","192.168.101.100","66","2014  >  43352 [ACK] Seq=1 Ack=131375 Win=1388 Len=0 TSval=2668849107 TSecr=3395106874"
"2041","105.892001303","192.168.101.100","192.168.101.200","1612","43352  >  2014 [PSH, ACK] Seq=131375 Ack=1 Win=501 Len=1546 TSval=3395107882 TSecr=2668849107"
"2043","105.892472310","192.168.101.200","192.168.101.100","66","2014  >  43352 [ACK] Seq=1 Ack=132921 Win=1388 Len=0 TSval=2668850115 TSecr=3395107882"
"2057","106.899054123","192.168.101.100","192.168.101.200","1612","43352  >  2014 [PSH, ACK] Seq=132921 Ack=1 Win=501 Len=1546 TSval=3395108889 TSecr=2668850115"
"2059","106.899488817","192.168.101.200","192.168.101.100","66","2014  >  43352 [ACK] Seq=1 Ack=134467 Win=1388 Len=0 TSval=2668851122 TSecr=3395108889"
"2076","107.916409824","192.168.101.100","192.168.101.200","1612","43352  >  2014 [PSH, ACK] Seq=134467 Ack=1 Win=501 Len=1546 TSval=3395109906 TSecr=2668851122"
"2078","107.953310356","192.168.101.200","192.168.101.100","78","[TCP Window Update] 2014  >  43352 [ACK] Seq=1 Ack=134467 Win=1396 Len=0 TSval=2668852176 TSecr=3395108889 SLE=135915 SRE=136013"
"2080","108.001677053","192.168.101.100","192.168.101.200","1514","[TCP Retransmission] 43352  >  2014 [ACK] Seq=134467 Ack=1 Win=501 Len=1448 TSval=3395109992 TSecr=2668852176"
"2082","108.005762326","192.168.101.200","192.168.101.100","66","2014  >  43352 [ACK] Seq=1 Ack=136013 Win=1388 Len=0 TSval=2668852226 TSecr=3395109992"
"2096","108.926148866","192.168.101.100","192.168.101.200","1514","43352  >  2014 [ACK] Seq=136013 Ack=1 Win=501 Len=1448 TSval=3395110916 TSecr=2668852226"
"2097","108.926205779","192.168.101.100","192.168.101.200","160","43352  >  2014 [PSH, ACK] Seq=137461 Ack=1 Win=501 Len=94 TSval=3395110916 TSecr=2668852226"
"2099","108.957090786","192.168.101.200","192.168.101.100","78","[TCP Window Update] 2014  >  43352 [ACK] Seq=1 Ack=136013 Win=1396 Len=0 TSval=2668853179 TSecr=3395109992 SLE=137461 SRE=137555"
"2101","109.005657903","192.168.101.100","192.168.101.200","1514","[TCP Retransmission] 43352  >  2014 [ACK] Seq=136013 Ack=1 Win=501 Len=1448 TSval=3395110995 TSecr=2668853179"
"2103","109.006290533","192.168.101.200","192.168.101.100","66","2014  >  43352 [ACK] Seq=1 Ack=137555 Win=1388 Len=0 TSval=2668853229 TSecr=3395110995"
"2118","109.935630711","192.168.101.100","192.168.101.200","1514","43352  >  2014 [ACK] Seq=137555 Ack=1 Win=501 Len=1448 TSval=3395111925 TSecr=2668853229"
"2119","109.935690314","192.168.101.100","192.168.101.200","164","43352  >  2014 [PSH, ACK] Seq=139003 Ack=1 Win=501 Len=98 TSval=3395111925 TSecr=2668853229"
"2121","109.936057572","192.168.101.200","192.168.101.100","66","2014  >  43352 [ACK] Seq=1 Ack=139003 Win=1391 Len=0 TSval=2668854158 TSecr=3395111925"
"2127","110.262316782","192.168.101.100","192.168.101.200","164","[TCP Retransmission] 43352  >  2014 [PSH, ACK] Seq=139003 Ack=1 Win=501 Len=98 TSval=3395112252 TSecr=2668854158"
"2129","110.262850152","192.168.101.200","192.168.101.100","66","2014  >  43352 [ACK] Seq=1 Ack=139101 Win=1396 Len=0 TSval=2668854485 TSecr=3395112252"
"2143","110.949542754","192.168.101.100","192.168.101.200","1514","43352  >  2014 [ACK] Seq=139101 Ack=1 Win=501 Len=1448 TSval=3395112939 TSecr=2668854485"
"2144","110.949721489","192.168.101.100","192.168.101.200","164","43352  >  2014 [PSH, ACK] Seq=140549 Ack=1 Win=501 Len=98 TSval=3395112939 TSecr=2668854485"
"2146","110.950475883","192.168.101.200","192.168.101.100","66","2014  >  43352 [ACK] Seq=1 Ack=140549 Win=1391 Len=0 TSval=2668855173 TSecr=3395112939"
"2148","110.953994264","192.168.101.200","192.168.101.100","66","2014  >  43352 [ACK] Seq=1 Ack=140647 Win=1396 Len=0 TSval=2668855176 TSecr=3395112939"
"2162","111.952573187","192.168.101.100","192.168.101.200","1514","43352  >  2014 [ACK] Seq=140647 Ack=1 Win=501 Len=1448 TSval=3395113942 TSecr=2668855176"
"2163","111.952654464","192.168.101.100","192.168.101.200","164","43352  >  2014 [PSH, ACK] Seq=142095 Ack=1 Win=501 Len=98 TSval=3395113942 TSecr=2668855176"
"2165","111.953013697","192.168.101.200","192.168.101.100","66","2014  >  43352 [ACK] Seq=1 Ack=142095 Win=1391 Len=0 TSval=2668856175 TSecr=3395113942"
"2167","111.957282992","192.168.101.200","192.168.101.100","66","2014  >  43352 [ACK] Seq=1 Ack=142193 Win=1396 Len=0 TSval=2668856179 TSecr=3395113942"
"2183","112.964058355","192.168.101.100","192.168.101.200","1514","43352  >  2014 [ACK] Seq=142193 Ack=1 Win=501 Len=1448 TSval=3395114954 TSecr=2668856179"
"2184","112.964106426","192.168.101.100","192.168.101.200","164","43352  >  2014 [PSH, ACK] Seq=143641 Ack=1 Win=501 Len=98 TSval=3395114954 TSecr=2668856179"
"2186","112.964492585","192.168.101.200","192.168.101.100","78","[TCP Dup ACK 2169#1] 2014  >  43352 [ACK] Seq=1 Ack=142193 Win=1396 Len=0 TSval=2668857187 TSecr=3395113942 SLE=143641 SRE=143739"
"2187","113.045922692","192.168.101.100","192.168.101.200","164","[TCP Retransmission] 43352  >  2014 [PSH, ACK] Seq=143641 Ack=1 Win=501 Len=98 TSval=3395115036 TSecr=2668856179"
"2189","113.058063340","192.168.101.100","192.168.101.200","1514","[TCP Fast Retransmission] 43352  >  2014 [ACK] Seq=142193 Ack=1 Win=501 Len=1448 TSval=3395115048 TSecr=2668857187"
"2191","113.058241461","192.168.101.200","192.168.101.100","86","[TCP Dup ACK 2169#3] 2014  >  43352 [ACK] Seq=1 Ack=142193 Win=1396 Len=0 TSval=2668857280 TSecr=3395113942 SLE=143641 SRE=143739 SLE=143641 SRE=143739"
"2193","113.058664226","192.168.101.200","192.168.101.100","66","2014  >  43352 [ACK] Seq=1 Ack=143739 Win=1388 Len=0 TSval=2668857281 TSecr=3395115048"
"2209","113.982367473","192.168.101.100","192.168.101.200","1514","43352  >  2014 [ACK] Seq=143739 Ack=1 Win=501 Len=1448 TSval=3395115972 TSecr=2668857281"
"2210","113.982412339","192.168.101.100","192.168.101.200","164","43352  >  2014 [PSH, ACK] Seq=145187 Ack=1 Win=501 Len=98 TSval=3395115972 TSecr=2668857281"
"2212","113.982827220","192.168.101.200","192.168.101.100","66","2014  >  43352 [ACK] Seq=1 Ack=145285 Win=1388 Len=0 TSval=2668858205 TSecr=3395115972"
"2226","114.990874094","192.168.101.100","192.168.101.200","1514","43352  >  2014 [ACK] Seq=145285 Ack=1 Win=501 Len=1448 TSval=3395116980 TSecr=2668858205"
"2227","114.990934540","192.168.101.100","192.168.101.200","164","43352  >  2014 [PSH, ACK] Seq=146733 Ack=1 Win=501 Len=98 TSval=3395116980 TSecr=2668858205"
"2229","114.991329099","192.168.101.200","192.168.101.100","66","2014  >  43352 [ACK] Seq=1 Ack=146831 Win=1388 Len=0 TSval=2668859213 TSecr=3395116980"
"2245","115.998383420","192.168.101.100","192.168.101.200","1612","43352  >  2014 [PSH, ACK] Seq=146831 Ack=1 Win=501 Len=1546 TSval=3395117988 TSecr=2668859213"
"2247","116.064018083","192.168.101.200","192.168.101.100","78","[TCP Window Update] 2014  >  43352 [ACK] Seq=1 Ack=146831 Win=1396 Len=0 TSval=2668860286 TSecr=3395116980 SLE=148279 SRE=148377"
"2248","116.113993200","192.168.101.100","192.168.101.200","164","[TCP Retransmission] 43352  >  2014 [PSH, ACK] Seq=148279 Ack=1 Win=501 Len=98 TSval=3395118104 TSecr=2668859213"
"2250","116.114448799","192.168.101.200","192.168.101.100","86","[TCP Dup ACK 2229#2] 2014  >  43352 [ACK] Seq=1 Ack=146831 Win=1396 Len=0 TSval=2668860337 TSecr=3395116980 SLE=148279 SRE=148377 SLE=148279 SRE=148377"
"2252","116.114599784","192.168.101.100","192.168.101.200","1514","[TCP Fast Retransmission] 43352  >  2014 [ACK] Seq=146831 Ack=1 Win=501 Len=1448 TSval=3395118104 TSecr=2668860337"
"2254","116.114916668","192.168.101.200","192.168.101.100","66","2014  >  43352 [ACK] Seq=1 Ack=148377 Win=1388 Len=0 TSval=2668860337 TSecr=3395118104"
"2264","117.008430317","192.168.101.100","192.168.101.200","1514","43352  >  2014 [ACK] Seq=148377 Ack=1 Win=501 Len=1448 TSval=3395118998 TSecr=2668860337"
"2265","117.008490351","192.168.101.100","192.168.101.200","160","43352  >  2014 [PSH, ACK] Seq=149825 Ack=1 Win=501 Len=94 TSval=3395118998 TSecr=2668860337"
"2267","117.008906667","192.168.101.200","192.168.101.100","66","2014  >  43352 [ACK] Seq=1 Ack=149919 Win=1388 Len=0 TSval=2668861231 TSecr=3395118998"
"2283","118.020361018","192.168.101.100","192.168.101.200","1514","43352  >  2014 [ACK] Seq=149919 Ack=1 Win=501 Len=1448 TSval=3395120010 TSecr=2668861231"
"2284","118.020454806","192.168.101.100","192.168.101.200","164","43352  >  2014 [PSH, ACK] Seq=151367 Ack=1 Win=501 Len=98 TSval=3395120010 TSecr=2668861231"
"2286","118.020877213","192.168.101.200","192.168.101.100","66","2014  >  43352 [ACK] Seq=1 Ack=151465 Win=1388 Len=0 TSval=2668862243 TSecr=3395120010"
"2303","119.029692832","192.168.101.100","192.168.101.200","1514","43352  >  2014 [ACK] Seq=151465 Ack=1 Win=501 Len=1448 TSval=3395121019 TSecr=2668862243"
"2304","119.029733104","192.168.101.100","192.168.101.200","164","43352  >  2014 [PSH, ACK] Seq=152913 Ack=1 Win=501 Len=98 TSval=3395121019 TSecr=2668862243"
"2306","119.030079943","192.168.101.200","192.168.101.100","66","2014  >  43352 [ACK] Seq=1 Ack=152913 Win=1391 Len=0 TSval=2668863252 TSecr=3395121019"
"2311","119.059159404","192.168.101.200","192.168.101.100","66","2014  >  43352 [ACK] Seq=1 Ack=153011 Win=1396 Len=0 TSval=2668863281 TSecr=3395121019"
"2327","120.039095520","192.168.101.100","192.168.101.200","1514","43352  >  2014 [ACK] Seq=153011 Ack=1 Win=501 Len=1448 TSval=3395122029 TSecr=2668863281"
"2328","120.039137089","192.168.101.100","192.168.101.200","164","43352  >  2014 [PSH, ACK] Seq=154459 Ack=1 Win=501 Len=98 TSval=3395122029 TSecr=2668863281"
"2330","120.039539058","192.168.101.200","192.168.101.100","66","2014  >  43352 [ACK] Seq=1 Ack=154459 Win=1391 Len=0 TSval=2668864262 TSecr=3395122029"
"2334","120.058487463","192.168.101.200","192.168.101.100","66","2014  >  43352 [ACK] Seq=1 Ack=154557 Win=1396 Len=0 TSval=2668864280 TSecr=3395122029"
