"No.","Time","Source","Destination","Protocol","Length","Info"
"55","8.994195210","192.168.101.100","192.168.101.200","TCP","1514","59058  >  5222 [ACK] Seq=1 Ack=1 Win=501 Len=1448 TSval=174038282 TSecr=421580303 [TCP segment of a reassembled PDU]"
"56","8.994235113","192.168.101.100","192.168.101.200","TCP","1514","59058  >  5222 [ACK] Seq=1449 Ack=1 Win=501 Len=1448 TSval=174038282 TSecr=421580303 [TCP segment of a reassembled PDU]"
"57","9.155329362","192.168.101.100","192.168.101.200","TCP","615","59058  >  5222 [PSH, ACK] Seq=2897 Ack=1 Win=501 Len=549 TSval=174038443 TSecr=421580303 [TCP segment of a reassembled PDU]"
"59","9.155972040","192.168.101.200","192.168.101.100","TCP","78","5222  >  59058 [ACK] Seq=1 Ack=1 Win=735 Len=0 TSval=421609168 TSecr=174009578 SLE=2897 SRE=3446"
"61","9.156192772","192.168.101.100","192.168.101.200","TCP","1514","[TCP Out-Of-Order] 59058  >  5222 [ACK] Seq=1 Ack=1 Win=501 Len=1448 TSval=174038444 TSecr=421609168"
"63","9.156724995","192.168.101.200","192.168.101.100","TCP","78","5222  >  59058 [ACK] Seq=1 Ack=1449 Win=724 Len=0 TSval=421609169 TSecr=174038444 SLE=2897 SRE=3446"
"67","9.208348620","192.168.101.100","192.168.101.200","TCP","1514","[TCP Retransmission] 59058  >  5222 [ACK] Seq=1449 Ack=1 Win=501 Len=1448 TSval=174038496 TSecr=421609169"
"68","9.507602997","192.168.101.100","192.168.101.200","TCP","1514","[TCP Retransmission] 59058  >  5222 [ACK] Seq=1449 Ack=1 Win=501 Len=1448 TSval=174038796 TSecr=421609169"
"70","9.508330204","192.168.101.200","192.168.101.100","TCP","66","5222  >  59058 [ACK] Seq=1 Ack=3446 Win=719 Len=0 TSval=421609520 TSecr=174038796"
"76","10.008097038","192.168.101.100","192.168.101.200","TCP","1514","59058  >  5222 [ACK] Seq=3446 Ack=1 Win=501 Len=1448 TSval=174039296 TSecr=421609520 [TCP segment of a reassembled PDU]"
"77","10.008257467","192.168.101.100","192.168.101.200","TCP","1514","59058  >  5222 [ACK] Seq=4894 Ack=1 Win=501 Len=1448 TSval=174039296 TSecr=421609520 [TCP segment of a reassembled PDU]"
"79","10.008704854","192.168.101.200","192.168.101.100","TCP","78","[TCP Window Update] 5222  >  59058 [ACK] Seq=1 Ack=3446 Win=726 Len=0 TSval=421610021 TSecr=174038796 SLE=4894 SRE=6342"
"81","10.008879287","192.168.101.100","192.168.101.200","TCP","615","59058  >  5222 [PSH, ACK] Seq=6342 Ack=1 Win=501 Len=549 TSval=174039297 TSecr=421610021 [TCP segment of a reassembled PDU]"
"82","10.027140810","192.168.101.100","192.168.101.200","TCP","1514","[TCP Fast Retransmission] 59058  >  5222 [ACK] Seq=3446 Ack=1 Win=501 Len=1448 TSval=174039315 TSecr=421610021 [TCP segment of a reassembled PDU]"
"85","10.106820092","192.168.101.200","192.168.101.100","TCP","78","[TCP Dup ACK 70#3] 5222  >  59058 [ACK] Seq=1 Ack=3446 Win=726 Len=0 TSval=421610119 TSecr=174038796 SLE=4894 SRE=6891"
"86","10.106822550","192.168.101.200","192.168.101.100","TCP","66","5222  >  59058 [ACK] Seq=1 Ack=6891 Win=711 Len=0 TSval=421610119 TSecr=174039315"
"93","11.017837062","192.168.101.100","192.168.101.200","TCP","1514","59058  >  5222 [ACK] Seq=6891 Ack=1 Win=501 Len=1448 TSval=174040306 TSecr=421610119 [TCP segment of a reassembled PDU]"
"94","11.017889274","192.168.101.100","192.168.101.200","TCP","1514","59058  >  5222 [ACK] Seq=8339 Ack=1 Win=501 Len=1448 TSval=174040306 TSecr=421610119 [TCP segment of a reassembled PDU]"
"96","11.018311694","192.168.101.200","192.168.101.100","TCP","66","5222  >  59058 [ACK] Seq=1 Ack=8339 Win=726 Len=0 TSval=421611031 TSecr=174040306"
"98","11.106730276","192.168.101.200","192.168.101.100","TCP","66","5222  >  59058 [ACK] Seq=1 Ack=9787 Win=726 Len=0 TSval=421611119 TSecr=174040306"
"99","11.191170384","192.168.101.100","192.168.101.200","TCP","615","59058  >  5222 [PSH, ACK] Seq=9787 Ack=1 Win=501 Len=549 TSval=174040479 TSecr=421610119 [TCP segment of a reassembled PDU]"
"102","11.204008229","192.168.101.200","192.168.101.100","TCP","66","5222  >  59058 [ACK] Seq=1 Ack=10336 Win=726 Len=0 TSval=421611216 TSecr=174040479"
"103","11.407171859","192.168.101.100","192.168.101.200","TCP","615","[TCP Spurious Retransmission] 59058  >  5222 [PSH, ACK] Seq=9787 Ack=1 Win=501 Len=549 TSval=174040695 TSecr=421611031 [TCP segment of a reassembled PDU]"
"105","11.407687109","192.168.101.200","192.168.101.100","TCP","78","[TCP Window Update] 5222  >  59058 [ACK] Seq=1 Ack=10336 Win=735 Len=0 TSval=421611420 TSecr=174040695 SLE=9787 SRE=10336"
"106","11.875791941","192.168.101.100","192.168.101.200","TCP","1514","[TCP Spurious Retransmission] 59058  >  5222 [ACK] Seq=8339 Ack=1 Win=501 Len=1448 TSval=174041164 TSecr=421611031 [TCP segment of a reassembled PDU]"
"111","12.770884753","192.168.101.100","192.168.101.200","TCP","1514","[TCP Spurious Retransmission] 59058  >  5222 [ACK] Seq=8339 Ack=1 Win=501 Len=1448 TSval=174042059 TSecr=421611031 [TCP segment of a reassembled PDU]"
"120","14.531474006","192.168.101.100","192.168.101.200","TCP","1514","[TCP Spurious Retransmission] 59058  >  5222 [ACK] Seq=8339 Ack=1 Win=501 Len=1448 TSval=174043820 TSecr=421611031 [TCP segment of a reassembled PDU]"
"132","18.082835483","192.168.101.100","192.168.101.200","TCP","1514","[TCP Spurious Retransmission] 59058  >  5222 [ACK] Seq=8339 Ack=1 Win=501 Len=1448 TSval=174047371 TSecr=421611031 [TCP segment of a reassembled PDU]"
"134","18.083368431","192.168.101.200","192.168.101.100","TCP","78","[TCP Dup ACK 102#1] 5222  >  59058 [ACK] Seq=1 Ack=10336 Win=735 Len=0 TSval=421618096 TSecr=174040695 SLE=8339 SRE=9787"
"169","25.251492969","192.168.101.100","192.168.101.200","TCP","1514","[TCP Spurious Retransmission] 59058  >  5222 [ACK] Seq=8339 Ack=1 Win=501 Len=1448 TSval=174054540 TSecr=421611031 [TCP segment of a reassembled PDU]"
"231","39.331022812","192.168.101.100","192.168.101.200","TCP","1514","[TCP Spurious Retransmission] 59058  >  5222 [ACK] Seq=8339 Ack=1 Win=501 Len=1448 TSval=174068620 TSecr=421611031 [TCP segment of a reassembled PDU]"
"233","39.331544976","192.168.101.200","192.168.101.100","TCP","78","[TCP Dup ACK 102#2] 5222  >  59058 [ACK] Seq=1 Ack=10336 Win=735 Len=0 TSval=421639345 TSecr=174040695 SLE=8339 SRE=9787"
"235","39.331800217","192.168.101.100","192.168.101.200","TCP","1514","59058  >  5222 [ACK] Seq=10336 Ack=1 Win=501 Len=1448 TSval=174068621 TSecr=421639345 [TCP segment of a reassembled PDU]"
"236","39.331867395","192.168.101.100","192.168.101.200","TCP","1514","59058  >  5222 [ACK] Seq=11784 Ack=1 Win=501 Len=1448 TSval=174068621 TSecr=421639345 [TCP segment of a reassembled PDU]"
"237","39.331939180","192.168.101.100","192.168.101.200","TCP","1514","59058  >  5222 [ACK] Seq=13232 Ack=1 Win=501 Len=1448 TSval=174068621 TSecr=421639345 [TCP segment of a reassembled PDU]"
"239","39.332081284","192.168.101.200","192.168.101.100","TCP","66","5222  >  59058 [ACK] Seq=1 Ack=11784 Win=726 Len=0 TSval=421639345 TSecr=174068621"
"241","39.348503667","192.168.101.200","192.168.101.100","TCP","66","5222  >  59058 [ACK] Seq=1 Ack=13232 Win=726 Len=0 TSval=421639362 TSecr=174068621"
"243","39.446632190","192.168.101.200","192.168.101.100","TCP","66","5222  >  59058 [ACK] Seq=1 Ack=14680 Win=726 Len=0 TSval=421639460 TSecr=174068621"
"246","39.544597241","192.168.101.100","192.168.101.200","TCP","2962","59058  >  5222 [ACK] Seq=14680 Ack=1 Win=501 Len=2896 TSval=174068834 TSecr=421639345 [TCP segment of a reassembled PDU]"
"248","39.544673030","192.168.101.100","192.168.101.200","TCP","1514","59058  >  5222 [ACK] Seq=17576 Ack=1 Win=501 Len=1448 TSval=174068834 TSecr=421639362 [TCP segment of a reassembled PDU]"
"250","39.544697885","192.168.101.100","192.168.101.200","TCP","2962","59058  >  5222 [ACK] Seq=19024 Ack=1 Win=501 Len=2896 TSval=174068834 TSecr=421639460 [TCP segment of a reassembled PDU]"
"254","39.544936951","192.168.101.200","192.168.101.100","TCP","66","5222  >  59058 [ACK] Seq=1 Ack=16128 Win=726 Len=0 TSval=421639558 TSecr=174068834"
"256","39.646894877","192.168.101.200","192.168.101.100","TCP","66","5222  >  59058 [ACK] Seq=1 Ack=17576 Win=726 Len=0 TSval=421639656 TSecr=174068834"
"259","39.838586897","192.168.101.200","192.168.101.100","TCP","78","[TCP Dup ACK 256#1] 5222  >  59058 [ACK] Seq=1 Ack=17576 Win=726 Len=0 TSval=421639852 TSecr=174068834 SLE=19024 SRE=20472"
"261","39.936545320","192.168.101.200","192.168.101.100","TCP","78","[TCP Dup ACK 256#2] 5222  >  59058 [ACK] Seq=1 Ack=17576 Win=726 Len=0 TSval=421639950 TSecr=174068834 SLE=19024 SRE=21920"
"264","40.034780274","192.168.101.100","192.168.101.200","XMPP/XML","1514","UNKNOWN PACKET "
"266","40.034911836","192.168.101.100","192.168.101.200","TCP","2962","59058  >  5222 [ACK] Seq=23368 Ack=1 Win=501 Len=2896 TSval=174069324 TSecr=421639656 [TCP segment of a reassembled PDU]"
"269","40.035048726","192.168.101.100","192.168.101.200","TCP","1514","59058  >  5222 [ACK] Seq=26264 Ack=1 Win=501 Len=1448 TSval=174069324 TSecr=421639950 [TCP segment of a reassembled PDU]"
"270","40.035126331","192.168.101.100","192.168.101.200","TCP","1514","59058  >  5222 [ACK] Seq=27712 Ack=1 Win=501 Len=1448 TSval=174069324 TSecr=421639950 [TCP segment of a reassembled PDU]"
"272","40.035389136","192.168.101.200","192.168.101.100","TCP","78","[TCP Dup ACK 265#3] 5222  >  59058 [ACK] Seq=1 Ack=17576 Win=726 Len=0 TSval=421640049 TSecr=174068834 SLE=19024 SRE=23368"
"273","40.055474343","192.168.101.100","192.168.101.200","TCP","1514","[TCP Retransmission] 59058  >  5222 [ACK] Seq=17576 Ack=1 Win=501 Len=1448 TSval=174069345 TSecr=421639950"
"275","40.132646814","192.168.101.200","192.168.101.100","TCP","78","[TCP Dup ACK 265#4] 5222  >  59058 [ACK] Seq=1 Ack=17576 Win=726 Len=0 TSval=421640146 TSecr=174068834 SLE=19024 SRE=24816"
"277","40.230511360","192.168.101.200","192.168.101.100","TCP","78","[TCP Dup ACK 265#5] 5222  >  59058 [ACK] Seq=1 Ack=17576 Win=726 Len=0 TSval=421640244 TSecr=174068834 SLE=19024 SRE=26264"
"279","40.328560731","192.168.101.200","192.168.101.100","TCP","78","[TCP Dup ACK 265#6] 5222  >  59058 [ACK] Seq=1 Ack=17576 Win=726 Len=0 TSval=421640342 TSecr=174068834 SLE=19024 SRE=27712"
"281","40.426787330","192.168.101.200","192.168.101.100","TCP","78","[TCP Dup ACK 265#7] 5222  >  59058 [ACK] Seq=1 Ack=17576 Win=726 Len=0 TSval=421640440 TSecr=174068834 SLE=19024 SRE=29160"
"284","40.524677678","192.168.101.100","192.168.101.200","TCP","1514","59058  >  5222 [ACK] Seq=29160 Ack=1 Win=501 Len=1448 TSval=174069814 TSecr=421640049 [TCP segment of a reassembled PDU]"
"288","40.622601574","192.168.101.100","192.168.101.200","TCP","1514","59058  >  5222 [ACK] Seq=30608 Ack=1 Win=501 Len=1448 TSval=174069912 TSecr=421640342 [TCP segment of a reassembled PDU]"
"290","40.622657590","192.168.101.100","192.168.101.200","TCP","1514","59058  >  5222 [ACK] Seq=32056 Ack=1 Win=501 Len=1448 TSval=174069912 TSecr=421640440 [TCP segment of a reassembled PDU]"
"294","40.720544197","192.168.101.200","192.168.101.100","TCP","86","[TCP Dup ACK 265#13] 5222  >  59058 [ACK] Seq=1 Ack=17576 Win=726 Len=0 TSval=421640734 TSecr=174068834 SLE=30608 SRE=32056 SLE=19024 SRE=29160"
"297","40.818808416","192.168.101.200","192.168.101.100","TCP","86","[TCP Dup ACK 265#14] 5222  >  59058 [ACK] Seq=1 Ack=17576 Win=726 Len=0 TSval=421640832 TSecr=174068834 SLE=30608 SRE=33504 SLE=19024 SRE=29160"
"299","40.916489021","192.168.101.100","192.168.101.200","TCP","1514","[TCP Fast Retransmission] 59058  >  5222 [ACK] Seq=17576 Ack=1 Win=501 Len=1448 TSval=174070206 TSecr=421640734[Reassembly error, protocol TCP: New fragment overlaps old data (retransmission?)]"
"301","40.916558883","192.168.101.100","192.168.101.200","TCP","1514","[TCP Retransmission] 59058  >  5222 [ACK] Seq=29160 Ack=1 Win=501 Len=1448 TSval=174070206 TSecr=421640832"
"303","40.916999459","192.168.101.200","192.168.101.100","TCP","78","5222  >  59058 [ACK] Seq=1 Ack=29160 Win=658 Len=0 TSval=421640930 TSecr=174070206 SLE=30608 SRE=33504"
"305","41.014625628","192.168.101.200","192.168.101.100","TCP","66","5222  >  59058 [ACK] Seq=1 Ack=33504 Win=711 Len=0 TSval=421641028 TSecr=174070206"
"307","41.112438657","192.168.101.100","192.168.101.200","TCP","1514","59058  >  5222 [ACK] Seq=33504 Ack=1 Win=501 Len=1448 TSval=174070402 TSecr=421640930 [TCP segment of a reassembled PDU]"
"309","41.112491201","192.168.101.100","192.168.101.200","TCP","1514","59058  >  5222 [ACK] Seq=34952 Ack=1 Win=501 Len=1448 TSval=174070402 TSecr=421641028 [TCP segment of a reassembled PDU]"
"311","41.112973354","192.168.101.200","192.168.101.100","TCP","66","5222  >  59058 [ACK] Seq=1 Ack=34952 Win=726 Len=0 TSval=421641126 TSecr=174070402"
"313","41.314754801","192.168.101.100","192.168.101.200","TCP","1514","59058  >  5222 [ACK] Seq=36400 Ack=1 Win=501 Len=1448 TSval=174070604 TSecr=421641126 [TCP segment of a reassembled PDU]"
"314","41.314940196","192.168.101.100","192.168.101.200","TCP","1514","59058  >  5222 [ACK] Seq=37848 Ack=1 Win=501 Len=1448 TSval=174070604 TSecr=421641126 [TCP segment of a reassembled PDU]"
"316","41.315605420","192.168.101.200","192.168.101.100","TCP","78","[TCP Dup ACK 311#2] 5222  >  59058 [ACK] Seq=1 Ack=34952 Win=726 Len=0 TSval=421641329 TSecr=174070402 SLE=36400 SRE=37848"
"318","41.408648176","192.168.101.200","192.168.101.100","TCP","78","[TCP Dup ACK 311#3] 5222  >  59058 [ACK] Seq=1 Ack=34952 Win=726 Len=0 TSval=421641422 TSecr=174070402 SLE=36400 SRE=39296"
"321","41.506577909","192.168.101.100","192.168.101.200","TCP","1514","[TCP Fast Retransmission] 59058  >  5222 [ACK] Seq=34952 Ack=1 Win=501 Len=1448 TSval=174070796 TSecr=421641329 [TCP segment of a reassembled PDU]"
"323","41.506630616","192.168.101.100","192.168.101.200","TCP","1514","59058  >  5222 [ACK] Seq=39296 Ack=1 Win=501 Len=1448 TSval=174070796 TSecr=421641422 [TCP segment of a reassembled PDU]"
"327","41.506919612","192.168.101.200","192.168.101.100","TCP","66","5222  >  59058 [ACK] Seq=1 Ack=39296 Win=711 Len=0 TSval=421641520 TSecr=174070796"
"330","41.604720578","192.168.101.200","192.168.101.100","TCP","66","5222  >  59058 [ACK] Seq=1 Ack=40744 Win=726 Len=0 TSval=421641618 TSecr=174070796"
"332","41.702650322","192.168.101.100","192.168.101.200","TCP","1514","59058  >  5222 [ACK] Seq=40744 Ack=1 Win=501 Len=1448 TSval=174070992 TSecr=421641520 [TCP segment of a reassembled PDU]"
"334","41.702682808","192.168.101.100","192.168.101.200","TCP","1514","59058  >  5222 [ACK] Seq=42192 Ack=1 Win=501 Len=1448 TSval=174070992 TSecr=421641618 [TCP segment of a reassembled PDU]"
"335","41.702711206","192.168.101.100","192.168.101.200","TCP","1514","59058  >  5222 [ACK] Seq=43640 Ack=1 Win=501 Len=1448 TSval=174070992 TSecr=421641618 [TCP segment of a reassembled PDU]"
"337","41.703069246","192.168.101.200","192.168.101.100","TCP","66","5222  >  59058 [ACK] Seq=1 Ack=42192 Win=726 Len=0 TSval=421641716 TSecr=174070992"
"339","41.800739079","192.168.101.200","192.168.101.100","TCP","66","5222  >  59058 [ACK] Seq=1 Ack=43640 Win=726 Len=0 TSval=421641814 TSecr=174070992"
"341","41.898611709","192.168.101.200","192.168.101.100","TCP","66","5222  >  59058 [ACK] Seq=1 Ack=45088 Win=726 Len=0 TSval=421641912 TSecr=174070992"
"343","41.996536250","192.168.101.100","192.168.101.200","TCP","1514","59058  >  5222 [ACK] Seq=45088 Ack=1 Win=501 Len=1448 TSval=174071286 TSecr=421641716 [TCP segment of a reassembled PDU]"
"345","41.996572224","192.168.101.100","192.168.101.200","TCP","1514","59058  >  5222 [ACK] Seq=46536 Ack=1 Win=501 Len=1448 TSval=174071286 TSecr=421641814 [TCP segment of a reassembled PDU]"
"347","41.996622682","192.168.101.100","192.168.101.200","TCP","1514","59058  >  5222 [ACK] Seq=47984 Ack=1 Win=501 Len=1448 TSval=174071286 TSecr=421641912 [TCP segment of a reassembled PDU]"
"349","41.996853750","192.168.101.200","192.168.101.100","TCP","66","5222  >  59058 [ACK] Seq=1 Ack=46536 Win=726 Len=0 TSval=421642010 TSecr=174071286"
"352","42.192661097","192.168.101.200","192.168.101.100","TCP","78","[TCP Dup ACK 349#1] 5222  >  59058 [ACK] Seq=1 Ack=46536 Win=726 Len=0 TSval=421642206 TSecr=174071286 SLE=47984 SRE=49432"
"354","42.290572764","192.168.101.100","192.168.101.200","TCP","1514","59058  >  5222 [ACK] Seq=49432 Ack=1 Win=501 Len=1448 TSval=174071580 TSecr=421642010 [TCP segment of a reassembled PDU]"
"356","42.290724299","192.168.101.100","192.168.101.200","TCP","1514","59058  >  5222 [ACK] Seq=50880 Ack=1 Win=501 Len=1448 TSval=174071580 TSecr=421642206 [TCP segment of a reassembled PDU]"
"358","42.291253854","192.168.101.200","192.168.101.100","TCP","78","[TCP Dup ACK 349#4] 5222  >  59058 [ACK] Seq=1 Ack=46536 Win=726 Len=0 TSval=421642305 TSecr=174071286 SLE=47984 SRE=50880"
"359","42.307700912","192.168.101.100","192.168.101.200","TCP","1514","[TCP Fast Retransmission] 59058  >  5222 [ACK] Seq=46536 Ack=1 Win=501 Len=1448 TSval=174071597 TSecr=421642206 [TCP segment of a reassembled PDU]"
"361","42.388720168","192.168.101.200","192.168.101.100","TCP","78","[TCP Dup ACK 349#5] 5222  >  59058 [ACK] Seq=1 Ack=46536 Win=726 Len=0 TSval=421642402 TSecr=174071286 SLE=47984 SRE=52328"
"365","42.584530038","192.168.101.100","192.168.101.200","TCP","1514","59058  >  5222 [ACK] Seq=52328 Ack=1 Win=501 Len=1448 TSval=174071874 TSecr=421642402 [TCP segment of a reassembled PDU]"
"399","51.875713082","192.168.101.100","192.168.101.200","TCP","1514","[TCP Retransmission] 59058  >  5222 [ACK] Seq=46536 Ack=1 Win=501 Len=1448 TSval=174081165 TSecr=421642402"
"401","51.876330337","192.168.101.200","192.168.101.100","TCP","66","5222  >  59058 [ACK] Seq=1 Ack=52328 Win=704 Len=0 TSval=421651890 TSecr=174081165"
"478","71.587782077","192.168.101.100","192.168.101.200","TCP","1514","[TCP Spurious Retransmission] 59058  >  5222 [ACK] Seq=46536 Ack=1 Win=501 Len=1448 TSval=174100878 TSecr=421642402 [TCP segment of a reassembled PDU]"
"480","71.588413197","192.168.101.200","192.168.101.100","TCP","78","[TCP Window Update] 5222  >  59058 [ACK] Seq=1 Ack=52328 Win=735 Len=0 TSval=421671603 TSecr=174081165 SLE=46536 SRE=47984"
"482","71.588609242","192.168.101.100","192.168.101.200","TCP","1514","59058  >  5222 [ACK] Seq=53776 Ack=1 Win=501 Len=1448 TSval=174100879 TSecr=421671603 [TCP segment of a reassembled PDU]"
"483","71.588678948","192.168.101.100","192.168.101.200","TCP","1514","59058  >  5222 [ACK] Seq=55224 Ack=1 Win=501 Len=1448 TSval=174100879 TSecr=421671603 [TCP segment of a reassembled PDU]"
"485","71.589035756","192.168.101.200","192.168.101.100","TCP","78","[TCP Dup ACK 401#2] 5222  >  59058 [ACK] Seq=1 Ack=52328 Win=735 Len=0 TSval=421671604 TSecr=174081165 SLE=53776 SRE=55224"
"487","71.654198495","192.168.101.200","192.168.101.100","TCP","78","[TCP Dup ACK 401#3] 5222  >  59058 [ACK] Seq=1 Ack=52328 Win=735 Len=0 TSval=421671669 TSecr=174081165 SLE=53776 SRE=56672"
"489","71.751955596","192.168.101.100","192.168.101.200","TCP","1514","[TCP Fast Retransmission] 59058  >  5222 [ACK] Seq=52328 Ack=1 Win=501 Len=1448 TSval=174101042 TSecr=421671604 [TCP segment of a reassembled PDU]"
"491","71.752054674","192.168.101.100","192.168.101.200","TCP","1514","59058  >  5222 [ACK] Seq=56672 Ack=1 Win=501 Len=1448 TSval=174101042 TSecr=421671669 [TCP segment of a reassembled PDU]"
"493","71.752442915","192.168.101.200","192.168.101.100","TCP","66","5222  >  59058 [ACK] Seq=1 Ack=56672 Win=711 Len=0 TSval=421671767 TSecr=174101042"
"495","71.850360475","192.168.101.200","192.168.101.100","TCP","66","5222  >  59058 [ACK] Seq=1 Ack=58120 Win=726 Len=0 TSval=421671865 TSecr=174101042"
"497","71.948130260","192.168.101.100","192.168.101.200","TCP","1514","59058  >  5222 [ACK] Seq=58120 Ack=1 Win=501 Len=1448 TSval=174101239 TSecr=421671767 [TCP segment of a reassembled PDU]"
"498","71.948545170","192.168.101.100","192.168.101.200","TCP","1514","59058  >  5222 [ACK] Seq=59568 Ack=1 Win=501 Len=1448 TSval=174101239 TSecr=421671767 [TCP segment of a reassembled PDU]"
"500","71.948609932","192.168.101.100","192.168.101.200","TCP","1514","59058  >  5222 [ACK] Seq=61016 Ack=1 Win=501 Len=1448 TSval=174101239 TSecr=421671865 [TCP segment of a reassembled PDU]"
"502","71.948910141","192.168.101.200","192.168.101.100","TCP","66","5222  >  59058 [ACK] Seq=1 Ack=59568 Win=726 Len=0 TSval=421671963 TSecr=174101239"
"505","72.046004622","192.168.101.200","192.168.101.100","TCP","66","5222  >  59058 [ACK] Seq=1 Ack=61016 Win=726 Len=0 TSval=421672061 TSecr=174101239"
"507","72.143955761","192.168.101.200","192.168.101.100","TCP","66","5222  >  59058 [ACK] Seq=1 Ack=62464 Win=726 Len=0 TSval=421672158 TSecr=174101239"
"509","72.242011074","192.168.101.100","192.168.101.200","TCP","2962","59058  >  5222 [ACK] Seq=62464 Ack=1 Win=501 Len=2896 TSval=174101532 TSecr=421671963 [TCP segment of a reassembled PDU]"
"521","75.427667464","192.168.101.100","192.168.101.200","TCP","1514","59058  >  5222 [ACK] Seq=65360 Ack=1 Win=501 Len=1448 TSval=174104718 TSecr=421671963 [TCP segment of a reassembled PDU]"
"523","75.428055062","192.168.101.200","192.168.101.100","TCP","78","5222  >  59058 [ACK] Seq=1 Ack=62464 Win=726 Len=0 TSval=421675443 TSecr=174101239 SLE=65360 SRE=66808"
"525","75.428305042","192.168.101.100","192.168.101.200","TCP","2962","59058  >  5222 [ACK] Seq=66808 Ack=1 Win=501 Len=2896 TSval=174104719 TSecr=421675443 [TCP segment of a reassembled PDU]"
"527","75.428818340","192.168.101.200","192.168.101.100","TCP","78","[TCP Dup ACK 523#2] 5222  >  59058 [ACK] Seq=1 Ack=62464 Win=726 Len=0 TSval=421675443 TSecr=174101239 SLE=65360 SRE=68256"
"529","75.446180648","192.168.101.200","192.168.101.100","TCP","78","[TCP Dup ACK 523#3] 5222  >  59058 [ACK] Seq=1 Ack=62464 Win=726 Len=0 TSval=421675461 TSecr=174101239 SLE=65360 SRE=69704"
"531","75.544101174","192.168.101.100","192.168.101.200","TCP","1514","[TCP Fast Retransmission] 59058  >  5222 [ACK] Seq=62464 Ack=1 Win=501 Len=1448 TSval=174104835 TSecr=421675443 [TCP segment of a reassembled PDU]"
"533","75.544151740","192.168.101.100","192.168.101.200","TCP","1514","[TCP Retransmission] 59058  >  5222 [ACK] Seq=63912 Ack=1 Win=501 Len=1448 TSval=174104835 TSecr=421675461"
"535","75.544634141","192.168.101.200","192.168.101.100","TCP","78","5222  >  59058 [ACK] Seq=1 Ack=63912 Win=715 Len=0 TSval=421675559 TSecr=174104835 SLE=65360 SRE=69704"
"537","75.642195277","192.168.101.200","192.168.101.100","TCP","66","5222  >  59058 [ACK] Seq=1 Ack=69704 Win=704 Len=0 TSval=421675657 TSecr=174104835"
"539","75.740151250","192.168.101.100","192.168.101.200","TCP","1514","59058  >  5222 [ACK] Seq=69704 Ack=1 Win=501 Len=1448 TSval=174105031 TSecr=421675559 [TCP segment of a reassembled PDU]"
"540","75.740185529","192.168.101.100","192.168.101.200","TCP","1514","59058  >  5222 [ACK] Seq=71152 Ack=1 Win=501 Len=1448 TSval=174105031 TSecr=421675559 [TCP segment of a reassembled PDU]"
"542","75.740254779","192.168.101.100","192.168.101.200","TCP","1514","59058  >  5222 [ACK] Seq=72600 Ack=1 Win=501 Len=1448 TSval=174105031 TSecr=421675657 [TCP segment of a reassembled PDU]"
"544","75.740654560","192.168.101.200","192.168.101.100","TCP","66","5222  >  59058 [ACK] Seq=1 Ack=71152 Win=726 Len=0 TSval=421675755 TSecr=174105031"
"554","77.987370692","192.168.101.100","192.168.101.200","TCP","1514","59058  >  5222 [ACK] Seq=74048 Ack=1 Win=501 Len=1448 TSval=174107278 TSecr=421675657 [TCP segment of a reassembled PDU]"
"556","77.989283888","192.168.101.200","192.168.101.100","TCP","78","[TCP Dup ACK 544#1] 5222  >  59058 [ACK] Seq=1 Ack=71152 Win=726 Len=0 TSval=421678003 TSecr=174105031 SLE=74048 SRE=75496"
"558","77.989305896","192.168.101.100","192.168.101.200","TCP","2962","59058  >  5222 [ACK] Seq=75496 Ack=1 Win=501 Len=2896 TSval=174107280 TSecr=421678003 [TCP segment of a reassembled PDU]"
"560","77.990756095","192.168.101.200","192.168.101.100","TCP","78","[TCP Dup ACK 544#3] 5222  >  59058 [ACK] Seq=1 Ack=71152 Win=726 Len=0 TSval=421678005 TSecr=174105031 SLE=74048 SRE=76944"
"561","78.007687197","192.168.101.100","192.168.101.200","TCP","1514","[TCP Fast Retransmission] 59058  >  5222 [ACK] Seq=71152 Ack=1 Win=501 Len=1448 TSval=174107298 TSecr=421678003 [TCP segment of a reassembled PDU]"
"563","78.037267812","192.168.101.200","192.168.101.100","TCP","78","[TCP Dup ACK 544#4] 5222  >  59058 [ACK] Seq=1 Ack=71152 Win=726 Len=0 TSval=421678052 TSecr=174105031 SLE=74048 SRE=78392"
"570","78.135467007","192.168.101.200","192.168.101.100","TCP","78","5222  >  59058 [ACK] Seq=1 Ack=72600 Win=715 Len=0 TSval=421678150 TSecr=174107298 SLE=74048 SRE=78392"
"573","78.233249966","192.168.101.100","192.168.101.200","TCP","1514","[TCP Retransmission] 59058  >  5222 [ACK] Seq=72600 Ack=1 Win=501 Len=1448 TSval=174107524 TSecr=421678052"
"575","78.233299484","192.168.101.100","192.168.101.200","TCP","1514","59058  >  5222 [ACK] Seq=78392 Ack=1 Win=501 Len=1448 TSval=174107524 TSecr=421678150 [TCP segment of a reassembled PDU]"
"579","78.331336790","192.168.101.200","192.168.101.100","TCP","78","[TCP Dup ACK 574#1] 5222  >  59058 [ACK] Seq=1 Ack=72600 Win=715 Len=0 TSval=421678346 TSecr=174107298 SLE=74048 SRE=79840"
"583","78.441153201","192.168.101.100","192.168.101.200","TCP","1514","59058  >  5222 [ACK] Seq=79840 Ack=1 Win=501 Len=1448 TSval=174107732 TSecr=421678346 [TCP segment of a reassembled PDU]"
"584","78.455183865","192.168.101.100","192.168.101.200","TCP","1514","[TCP Fast Retransmission] 59058  >  5222 [ACK] Seq=72600 Ack=1 Win=501 Len=1448 TSval=174107746 TSecr=421678346 [TCP segment of a reassembled PDU]"
"586","78.535715624","192.168.101.200","192.168.101.100","TCP","66","5222  >  59058 [ACK] Seq=1 Ack=79840 Win=696 Len=0 TSval=421678550 TSecr=174107746"
"635","92.578773808","192.168.101.100","192.168.101.200","TCP","1514","[TCP Spurious Retransmission] 59058  >  5222 [ACK] Seq=72600 Ack=1 Win=501 Len=1448 TSval=174121870 TSecr=421678346 [TCP segment of a reassembled PDU]"
"637","92.579377028","192.168.101.200","192.168.101.100","TCP","78","[TCP Window Update] 5222  >  59058 [ACK] Seq=1 Ack=79840 Win=735 Len=0 TSval=421692595 TSecr=174107746 SLE=72600 SRE=74048"
"639","92.579492707","192.168.101.100","192.168.101.200","TCP","1514","[TCP Retransmission] 59058  >  5222 [ACK] Seq=79840 Ack=1 Win=501 Len=1448 TSval=174121871 TSecr=421692595"
"640","92.579542154","192.168.101.100","192.168.101.200","TCP","1514","59058  >  5222 [ACK] Seq=81288 Ack=1 Win=501 Len=1448 TSval=174121871 TSecr=421692595 [TCP segment of a reassembled PDU]"
"642","92.579837383","192.168.101.200","192.168.101.100","TCP","66","5222  >  59058 [ACK] Seq=1 Ack=81288 Win=726 Len=0 TSval=421692595 TSecr=174121871"
"644","92.757510154","192.168.101.100","192.168.101.200","TCP","1514","59058  >  5222 [ACK] Seq=82736 Ack=1 Win=501 Len=1448 TSval=174122049 TSecr=421692595 [TCP segment of a reassembled PDU]"
"645","92.757546135","192.168.101.100","192.168.101.200","TCP","1514","59058  >  5222 [ACK] Seq=84184 Ack=1 Win=501 Len=1448 TSval=174122049 TSecr=421692595 [TCP segment of a reassembled PDU]"
"647","92.861070328","192.168.101.200","192.168.101.100","TCP","78","[TCP Dup ACK 642#2] 5222  >  59058 [ACK] Seq=1 Ack=81288 Win=726 Len=0 TSval=421692876 TSecr=174121871 SLE=84184 SRE=85632"
"649","92.963095096","192.168.101.100","192.168.101.200","TCP","1514","[TCP Fast Retransmission] 59058  >  5222 [ACK] Seq=81288 Ack=1 Win=501 Len=1448 TSval=174122254 TSecr=421692876 [TCP segment of a reassembled PDU]"
"651","92.963575931","192.168.101.200","192.168.101.100","TCP","78","5222  >  59058 [ACK] Seq=1 Ack=82736 Win=718 Len=0 TSval=421692979 TSecr=174122254 SLE=84184 SRE=85632"
"652","92.983774464","192.168.101.100","192.168.101.200","TCP","1514","[TCP Retransmission] 59058  >  5222 [ACK] Seq=82736 Ack=1 Win=501 Len=1448 TSval=174122275 TSecr=421692876"
"654","93.056221740","192.168.101.100","192.168.101.200","TCP","1514","59058  >  5222 [ACK] Seq=85632 Ack=1 Win=501 Len=1448 TSval=174122347 TSecr=421692979 [TCP segment of a reassembled PDU]"
"656","93.056456137","192.168.101.200","192.168.101.100","TCP","66","5222  >  59058 [ACK] Seq=1 Ack=85632 Win=719 Len=0 TSval=421693072 TSecr=174122275"
"658","93.154295886","192.168.101.200","192.168.101.100","TCP","66","5222  >  59058 [ACK] Seq=1 Ack=87080 Win=726 Len=0 TSval=421693170 TSecr=174122347"
"660","93.252102129","192.168.101.100","192.168.101.200","TCP","1514","59058  >  5222 [ACK] Seq=87080 Ack=1 Win=501 Len=1448 TSval=174122543 TSecr=421693170 [TCP segment of a reassembled PDU]"
"661","93.252168506","192.168.101.100","192.168.101.200","TCP","1514","59058  >  5222 [ACK] Seq=88528 Ack=1 Win=501 Len=1448 TSval=174122543 TSecr=421693170 [TCP segment of a reassembled PDU]"
"662","93.252199218","192.168.101.100","192.168.101.200","TCP","1514","59058  >  5222 [ACK] Seq=89976 Ack=1 Win=501 Len=1448 TSval=174122543 TSecr=421693170 [TCP segment of a reassembled PDU]"
"664","93.252605475","192.168.101.200","192.168.101.100","TCP","66","5222  >  59058 [ACK] Seq=1 Ack=88528 Win=726 Len=0 TSval=421693268 TSecr=174122543"
"667","93.350124051","192.168.101.200","192.168.101.100","TCP","66","5222  >  59058 [ACK] Seq=1 Ack=89976 Win=726 Len=0 TSval=421693365 TSecr=174122543"
"669","93.448127919","192.168.101.200","192.168.101.100","TCP","66","5222  >  59058 [ACK] Seq=1 Ack=91424 Win=726 Len=0 TSval=421693463 TSecr=174122543"
"671","93.546076452","192.168.101.100","192.168.101.200","TCP","1514","59058  >  5222 [ACK] Seq=91424 Ack=1 Win=501 Len=1448 TSval=174122837 TSecr=421693268 [TCP segment of a reassembled PDU]"
"674","93.546156394","192.168.101.100","192.168.101.200","TCP","1514","59058  >  5222 [ACK] Seq=92872 Ack=1 Win=501 Len=1448 TSval=174122837 TSecr=421693365 [TCP segment of a reassembled PDU]"
"677","93.546199177","192.168.101.100","192.168.101.200","TCP","1514","59058  >  5222 [ACK] Seq=94320 Ack=1 Win=501 Len=1448 TSval=174122837 TSecr=421693463 [TCP segment of a reassembled PDU]"
"679","93.546559463","192.168.101.200","192.168.101.100","TCP","66","5222  >  59058 [ACK] Seq=1 Ack=92872 Win=726 Len=0 TSval=421693562 TSecr=174122837"
"681","93.644397743","192.168.101.200","192.168.101.100","TCP","66","5222  >  59058 [ACK] Seq=1 Ack=94320 Win=726 Len=0 TSval=421693660 TSecr=174122837"
"684","93.742122971","192.168.101.200","192.168.101.100","TCP","66","5222  >  59058 [ACK] Seq=1 Ack=95768 Win=726 Len=0 TSval=421693757 TSecr=174122837"
"686","93.840364235","192.168.101.100","192.168.101.200","TCP","1514","59058  >  5222 [ACK] Seq=95768 Ack=1 Win=501 Len=1448 TSval=174123132 TSecr=421693562 [TCP segment of a reassembled PDU]"
"688","93.840456159","192.168.101.100","192.168.101.200","TCP","1514","59058  >  5222 [ACK] Seq=97216 Ack=1 Win=501 Len=1448 TSval=174123132 TSecr=421693757 [TCP segment of a reassembled PDU]"
"689","93.840535721","192.168.101.100","192.168.101.200","TCP","1514","59058  >  5222 [ACK] Seq=98664 Ack=1 Win=501 Len=1448 TSval=174123132 TSecr=421693757 [TCP segment of a reassembled PDU]"
"691","93.841008826","192.168.101.200","192.168.101.100","TCP","66","5222  >  59058 [ACK] Seq=1 Ack=97216 Win=726 Len=0 TSval=421693856 TSecr=174123132"
"693","93.938120950","192.168.101.200","192.168.101.100","TCP","66","5222  >  59058 [ACK] Seq=1 Ack=98664 Win=726 Len=0 TSval=421693953 TSecr=174123132"
"695","94.036226863","192.168.101.200","192.168.101.100","TCP","66","5222  >  59058 [ACK] Seq=1 Ack=100112 Win=726 Len=0 TSval=421694051 TSecr=174123132"
"697","94.134123566","192.168.101.100","192.168.101.200","TCP","1514","59058  >  5222 [ACK] Seq=100112 Ack=1 Win=501 Len=1448 TSval=174123425 TSecr=421693856 [TCP segment of a reassembled PDU]"
"699","94.134845473","192.168.101.200","192.168.101.100","TCP","66","5222  >  59058 [ACK] Seq=1 Ack=101560 Win=726 Len=0 TSval=421694150 TSecr=174123425"
"701","94.239880236","192.168.101.100","192.168.101.200","TCP","1514","59058  >  5222 [PSH, ACK] Seq=101560 Ack=1 Win=501 Len=1448 TSval=174123531 TSecr=421694150 [TCP segment of a reassembled PDU]"
"702","94.239914161","192.168.101.100","192.168.101.200","TCP","2962","59058  >  5222 [ACK] Seq=103008 Ack=1 Win=501 Len=2896 TSval=174123531 TSecr=421694150 [TCP segment of a reassembled PDU]"
"703","94.239939568","192.168.101.100","192.168.101.200","TCP","2962","59058  >  5222 [ACK] Seq=105904 Ack=1 Win=501 Len=2896 TSval=174123531 TSecr=421694150 [TCP segment of a reassembled PDU]"
"705","94.240236922","192.168.101.200","192.168.101.100","TCP","66","5222  >  59058 [ACK] Seq=1 Ack=103008 Win=726 Len=0 TSval=421694256 TSecr=174123531"
"707","94.332716501","192.168.101.200","192.168.101.100","TCP","66","5222  >  59058 [ACK] Seq=1 Ack=104456 Win=726 Len=0 TSval=421694348 TSecr=174123531"
"710","94.430852519","192.168.101.200","192.168.101.100","TCP","66","5222  >  59058 [ACK] Seq=1 Ack=105904 Win=726 Len=0 TSval=421694446 TSecr=174123531"
"712","94.569801270","192.168.101.200","192.168.101.100","TCP","66","5222  >  59058 [ACK] Seq=1 Ack=107352 Win=735 Len=0 TSval=421694585 TSecr=174123531"
"714","94.669531986","192.168.101.200","192.168.101.100","TCP","66","5222  >  59058 [ACK] Seq=1 Ack=108800 Win=735 Len=0 TSval=421694685 TSecr=174123531"
"716","94.724683230","192.168.101.100","192.168.101.200","TCP","1514","59058  >  5222 [ACK] Seq=108800 Ack=1 Win=501 Len=1448 TSval=174124016 TSecr=421694256 [TCP segment of a reassembled PDU]"
"720","94.724728687","192.168.101.100","192.168.101.200","TCP","2962","59058  >  5222 [ACK] Seq=110248 Ack=1 Win=501 Len=2896 TSval=174124016 TSecr=421694585 [TCP segment of a reassembled PDU]"
"722","94.724759950","192.168.101.100","192.168.101.200","TCP","2962","59058  >  5222 [ACK] Seq=113144 Ack=1 Win=501 Len=2896 TSval=174124016 TSecr=421694685 [TCP segment of a reassembled PDU]"
"725","94.822983406","192.168.101.200","192.168.101.100","TCP","78","[TCP Dup ACK 721#1] 5222  >  59058 [ACK] Seq=1 Ack=108800 Win=735 Len=0 TSval=421694838 TSecr=174123531 SLE=110248 SRE=111696"
"727","94.920859318","192.168.101.200","192.168.101.100","TCP","78","[TCP Dup ACK 721#2] 5222  >  59058 [ACK] Seq=1 Ack=108800 Win=735 Len=0 TSval=421694936 TSecr=174123531 SLE=110248 SRE=113144"
"729","95.018926432","192.168.101.200","192.168.101.100","TCP","78","[TCP Dup ACK 721#3] 5222  >  59058 [ACK] Seq=1 Ack=108800 Win=735 Len=0 TSval=421695034 TSecr=174123531 SLE=110248 SRE=114592"
"731","95.116780598","192.168.101.200","192.168.101.100","TCP","78","[TCP Dup ACK 721#4] 5222  >  59058 [ACK] Seq=1 Ack=108800 Win=735 Len=0 TSval=421695132 TSecr=174123531 SLE=110248 SRE=116040"
"733","95.214737806","192.168.101.100","192.168.101.200","TCP","1514","59058  >  5222 [ACK] Seq=116040 Ack=1 Win=501 Len=1448 TSval=174124506 TSecr=421694838 [TCP segment of a reassembled PDU]"
"736","95.214821294","192.168.101.100","192.168.101.200","TCP","1514","[TCP Fast Retransmission] 59058  >  5222 [ACK] Seq=108800 Ack=1 Win=501 Len=1448 TSval=174124506 TSecr=421695034 [TCP segment of a reassembled PDU]"
"738","95.214899028","192.168.101.100","192.168.101.200","TCP","1514","59058  >  5222 [ACK] Seq=117488 Ack=1 Win=501 Len=1448 TSval=174124506 TSecr=421695132 [TCP segment of a reassembled PDU]"
"740","95.215222669","192.168.101.200","192.168.101.100","TCP","78","[TCP Dup ACK 721#9] 5222  >  59058 [ACK] Seq=1 Ack=108800 Win=735 Len=0 TSval=421695231 TSecr=174123531 SLE=110248 SRE=117488"
"742","95.312766253","192.168.101.200","192.168.101.100","TCP","66","5222  >  59058 [ACK] Seq=1 Ack=117488 Win=689 Len=0 TSval=421695328 TSecr=174124506"
"745","95.410836261","192.168.101.200","192.168.101.100","TCP","66","5222  >  59058 [ACK] Seq=1 Ack=118936 Win=726 Len=0 TSval=421695426 TSecr=174124506"
"747","95.508692416","192.168.101.100","192.168.101.200","TCP","1514","59058  >  5222 [ACK] Seq=118936 Ack=1 Win=501 Len=1448 TSval=174124800 TSecr=421695231 [TCP segment of a reassembled PDU]"
"749","95.508772836","192.168.101.100","192.168.101.200","TCP","1514","59058  >  5222 [ACK] Seq=120384 Ack=1 Win=501 Len=1448 TSval=174124800 TSecr=421695328 [TCP segment of a reassembled PDU]"
"753","95.508808788","192.168.101.100","192.168.101.200","TCP","1514","59058  >  5222 [ACK] Seq=121832 Ack=1 Win=501 Len=1448 TSval=174124800 TSecr=421695426 [TCP segment of a reassembled PDU]"
"756","95.606819301","192.168.101.200","192.168.101.100","TCP","78","[TCP Dup ACK 751#1] 5222  >  59058 [ACK] Seq=1 Ack=118936 Win=726 Len=0 TSval=421695622 TSecr=174124506 SLE=120384 SRE=121832"
"758","95.704963413","192.168.101.200","192.168.101.100","TCP","78","[TCP Dup ACK 751#2] 5222  >  59058 [ACK] Seq=1 Ack=118936 Win=726 Len=0 TSval=421695720 TSecr=174124506 SLE=120384 SRE=123280"
"760","95.802662737","192.168.101.100","192.168.101.200","TCP","1514","59058  >  5222 [ACK] Seq=123280 Ack=1 Win=501 Len=1448 TSval=174125094 TSecr=421695622 [TCP segment of a reassembled PDU]"
"762","95.802721856","192.168.101.100","192.168.101.200","TCP","1514","59058  >  5222 [ACK] Seq=124728 Ack=1 Win=501 Len=1448 TSval=174125094 TSecr=421695720 [TCP segment of a reassembled PDU]"
"764","95.803109548","192.168.101.200","192.168.101.100","TCP","78","[TCP Dup ACK 751#5] 5222  >  59058 [ACK] Seq=1 Ack=118936 Win=726 Len=0 TSval=421695818 TSecr=174124506 SLE=120384 SRE=124728"
"765","95.819242731","192.168.101.100","192.168.101.200","TCP","1514","[TCP Fast Retransmission] 59058  >  5222 [ACK] Seq=118936 Ack=1 Win=501 Len=1448 TSval=174125111 TSecr=421695720 [TCP segment of a reassembled PDU]"
"767","95.900848759","192.168.101.200","192.168.101.100","TCP","78","[TCP Dup ACK 751#6] 5222  >  59058 [ACK] Seq=1 Ack=118936 Win=726 Len=0 TSval=421695916 TSecr=174124506 SLE=120384 SRE=126176"
"770","95.998811289","192.168.101.200","192.168.101.100","TCP","66","5222  >  59058 [ACK] Seq=1 Ack=126176 Win=696 Len=0 TSval=421696014 TSecr=174125111"
"772","96.097388601","192.168.101.100","192.168.101.200","TCP","1514","59058  >  5222 [ACK] Seq=126176 Ack=1 Win=501 Len=1448 TSval=174125389 TSecr=421695916 [TCP segment of a reassembled PDU]"
"774","96.098229208","192.168.101.200","192.168.101.100","TCP","66","5222  >  59058 [ACK] Seq=1 Ack=127624 Win=726 Len=0 TSval=421696114 TSecr=174125389"
"776","96.200608112","192.168.101.100","192.168.101.200","TCP","1514","59058  >  5222 [ACK] Seq=127624 Ack=1 Win=501 Len=1448 TSval=174125492 TSecr=421696114 [TCP segment of a reassembled PDU]"
"777","96.200679919","192.168.101.100","192.168.101.200","TCP","1514","59058  >  5222 [ACK] Seq=129072 Ack=1 Win=501 Len=1448 TSval=174125492 TSecr=421696114 [TCP segment of a reassembled PDU]"
"779","96.201249551","192.168.101.200","192.168.101.100","TCP","66","5222  >  59058 [ACK] Seq=1 Ack=129072 Win=726 Len=0 TSval=421696216 TSecr=174125492"
"781","96.295857477","192.168.101.200","192.168.101.100","TCP","66","5222  >  59058 [ACK] Seq=1 Ack=130520 Win=726 Len=0 TSval=421696311 TSecr=174125492"
"784","96.393648966","192.168.101.100","192.168.101.200","TCP","1514","59058  >  5222 [ACK] Seq=130520 Ack=1 Win=501 Len=1448 TSval=174125685 TSecr=421696216 [TCP segment of a reassembled PDU]"
"786","96.393692470","192.168.101.100","192.168.101.200","TCP","1514","59058  >  5222 [ACK] Seq=131968 Ack=1 Win=501 Len=1448 TSval=174125685 TSecr=421696311 [TCP segment of a reassembled PDU]"
"790","96.393938754","192.168.101.200","192.168.101.100","TCP","66","5222  >  59058 [ACK] Seq=1 Ack=131968 Win=726 Len=0 TSval=421696409 TSecr=174125685"
"793","96.491716380","192.168.101.200","192.168.101.100","TCP","66","5222  >  59058 [ACK] Seq=1 Ack=133416 Win=726 Len=0 TSval=421696507 TSecr=174125685"
"795","96.589728364","192.168.101.100","192.168.101.200","TCP","1514","59058  >  5222 [ACK] Seq=133416 Ack=1 Win=501 Len=1448 TSval=174125881 TSecr=421696409 [TCP segment of a reassembled PDU]"
"796","96.589775995","192.168.101.100","192.168.101.200","TCP","1514","59058  >  5222 [ACK] Seq=134864 Ack=1 Win=501 Len=1448 TSval=174125881 TSecr=421696409 [TCP segment of a reassembled PDU]"
"799","96.589824588","192.168.101.100","192.168.101.200","TCP","2962","59058  >  5222 [ACK] Seq=136312 Ack=1 Win=501 Len=2896 TSval=174125881 TSecr=421696507 [TCP segment of a reassembled PDU]"
